timestamp,datetime,comment-id,author-id,agrees,disagrees,moderated,comment-body
1651073146874,Wed Apr 27 22:25:46 WIB 2022,539,1081,89,126,1,"Zuerst das Leben leistbar machen, statt Belastung durch Öko Augenauswischerei."
1651072083848,Wed Apr 27 22:08:03 WIB 2022,522,1054,66,121,1,Vorteile für (kleine) Elektroautos (zB: gratis Parkpickerl für ganz Wien; einführen von E-Auto Straßen) -> E-Mobilität attraktiver machen
1651072003492,Wed Apr 27 22:06:43 WIB 2022,520,1074,406,48,1,Internationale Bahnverbindungen mehr fördern. Es kann nicht sein das Flug Graz Stockholm billiger ist als ein Zug.
1651071524131,Wed Apr 27 21:58:44 WIB 2022,508,15,167,179,1,"Bau des Lobautunnels, die ständigen Staus auf der Wiener Tangente erzeugen extrem viele Schadstoffe"
1651072912170,Wed Apr 27 22:21:52 WIB 2022,537,1094,34,33,1,Leistungslimit 250 Watt für E-Bikes in EU einheitl. auf 600W anheben+Beibehaltung 25km/h limit =gröss.Lasten und Berge befahren möglich
1651072849634,Wed Apr 27 22:20:49 WIB 2022,536,1114,100,24,1,Es braucht unabhängige objektive Energieberaterinnen die beim Umstieg auf E-Mobilität aufklären. Keine VerkäuferInnen.
1651072691722,Wed Apr 27 22:18:11 WIB 2022,535,1094,108,126,1,Autoraser mit mehr als 40 Km/h-Überschreitung Fahrzeug enteignen und versteigern spart viel Sprit und Co2 und Menschenleben
1651072623579,Wed Apr 27 22:17:03 WIB 2022,534,1094,137,15,1,Nord-Süd/Ost-West-Transit-Teile des LKW-Verkehrs auf die Schiene mittels Fast-Load Technik (LKW auf Waggon und umgekehrt) bringen
1651072530500,Wed Apr 27 22:15:30 WIB 2022,533,1100,1,0,-1,Im ganzen Land beabsichtigt Staus herbeiführen ist sicher nicht nützlich für das Klima.
1651072471074,Wed Apr 27 22:14:31 WIB 2022,532,1094,1,0,-1,Endlich Limit 90 Km/h auf Landstrassen einführen da um 90 km/H die Effizienz (Verbrauch:Geschwindigkeit) bei Fahrzeugen optimal ist
1651072410414,Wed Apr 27 22:13:30 WIB 2022,531,1012,164,125,-1,Fossile Treibstoffe gehören massiv verteuert. Jeder km muss schmerzen.Stattdessen rascher Ausbau der Öffis.
1651072336724,Wed Apr 27 22:12:16 WIB 2022,530,1094,73,43,1,Steuern für Flüge die nicht reine Warentransportflüge sind analog PKW anheben damit kann sehr viel in erneuerbare Energie invest. werden
1651072320460,Wed Apr 27 22:12:00 WIB 2022,529,1066,213,139,-1,"""normale"" Pendlerpauschale abschaffen, dafür die Öffi- und Radnutzerinnen besser belohnen."
1651122744945,Thu Apr 28 12:12:24 WIB 2022,804,1524,88,15,1,Kampagne starten gegen Müll in Straßengräben!
1651122314598,Thu Apr 28 12:05:14 WIB 2022,803,1383,217,50,1,"Zu Fußgehen und Radfahren ist gesund, die Wege, die wir verwenden, sollten angenehm gestaltet sein, damit wir mehr gehen und radeln."
1651121850779,Thu Apr 28 11:57:30 WIB 2022,802,1477,1,0,-1,"Öffentlichen Verkehr massiv ausbauen. Bessere Verfügbarkeit, sehr gute Umsteigrelationen, Pünktlichkeit, Sauberkeit"
1651121769784,Thu Apr 28 11:56:09 WIB 2022,801,1477,194,37,1,Durchdachte Raumplanung reduziert die Notwendigkeit für motorisierten Individualverkehr. Raumplanung in größerem Zusammenhang.
1651120297485,Thu Apr 28 11:31:37 WIB 2022,800,669,133,103,1,"""Green on demand"": An Bedarfsampeln sofortiges Einleiten der Grünphase für Fußgänger und Radler, ohne Warten in den Abgasen der Autos."
1651119491492,Thu Apr 28 11:18:11 WIB 2022,799,1515,1,0,-1,"Höhere Förderung für E-Autos, keine Förderung mehr für Plug-in Hybride Vorbild Deutschland, Dänemark"
1651110277046,Thu Apr 28 08:44:37 WIB 2022,798,671,1,0,-1,"Der Mensch kann das Klima nicht beeinflussen! Im Gegensatz zur Umwelt, die kann man schützen!"
1651110174170,Thu Apr 28 08:42:54 WIB 2022,797,671,59,119,1,Diesel-Motoren der neuen Generationen sind absolut sauber und umweltfreundlich.
1651109998992,Thu Apr 28 08:39:58 WIB 2022,796,671,1,0,-1,"Forschung in Wasserstoff-Technologie, E-Fuels- und Biogas-Antriebe fördern und forcieren."
1651109835347,Thu Apr 28 08:37:15 WIB 2022,795,671,62,26,1,"E-Mobilität in der aktuellen Form ist ein Irrweg, zu teuer, nicht nachhaltig und alles andere als umweltfreundlich."
1651102272715,Thu Apr 28 06:31:12 WIB 2022,794,1505,1,0,-1,"Fahrradfahrer sollen für die Benutzung der öffentlichen Straßen genau so ein Kennzeichen benötigen, sowie eine Haftpflichtversicherung."
1651101761996,Thu Apr 28 06:22:41 WIB 2022,793,1508,87,59,1,"Wenn man für Fußgänger und Radfahrer Unterführungen oder Überwege schaffen würde, würde der Verkehr besser fließen!"
1651101616993,Thu Apr 28 06:20:16 WIB 2022,792,1508,1,0,-1,Das ist true Bro!
1651101575943,Thu Apr 28 06:19:35 WIB 2022,791,1508,40,25,-1,"Nein, eher die Öffipreise senken und deren nutzen fördern!"
1651101475141,Thu Apr 28 06:17:55 WIB 2022,790,1508,64,19,1,"Nein eher die Anbindungen und die Erreichbarkeiten von Bahnhöfen etc. verbessern und die Öffipreise senken, dann erledigt sich das v. allein"
1651101279083,Thu Apr 28 06:14:39 WIB 2022,789,1508,100,25,1,"Ja Pendler und Familen freundliche Fahrpläne und Preise, dann 24/7 verfügbarkeit, die an Stoßzeiten und Streckenauslatung angepasst ist!"
1651100956722,Thu Apr 28 06:09:16 WIB 2022,788,1507,1,0,-1,Nur noch reine E-Mobilität in Städten um Feinstaub und Lärm zu verhindern!
1651100834216,Thu Apr 28 06:07:14 WIB 2022,787,1508,1,0,-1,"E-Autos schön und gut, aber das da viel Natur für die Rohstoff gewinnung der Akkus drauf geht, wird gerne vergessen!"
1651100028513,Thu Apr 28 05:53:48 WIB 2022,786,1495,142,51,-1,Dieselprivileg bei der Mineralölsteuer endlich abschaffen! Gleicher Steuersatz wie für Benzin.
1651099835513,Thu Apr 28 05:50:35 WIB 2022,785,1504,87,39,-1,Kosten für öffentliche Verkehrsmittel noch mehr reduzieren
1651099351206,Thu Apr 28 05:42:31 WIB 2022,784,1495,1,0,-1,"Mit Parkgebühren in wirksamer Höhe kann auch ohne KPZ der Autoverkehr stark verringert werden, ohne die Bürger mit der KPZ zu gängeln."
1651099039443,Thu Apr 28 05:37:19 WIB 2022,783,1495,26,34,1,Steuern auf den Kauf oder den Besitz von Kfz wie VoVA und Vers.St. fördern das Vielfahren. Abschaffen und durch km-abhängige Abg. ersetzen!
1651098500083,Thu Apr 28 05:28:20 WIB 2022,782,1495,88,37,1,Preisanreize und technologischer Wettbewerb sind wesentlich effizienter als Verbote und Maßnahmen aus dem Bereich der Kommandowirtschaft.
1651098317919,Thu Apr 28 05:25:17 WIB 2022,781,1495,25,29,-1,"Die Pendlerpauschale ist dann am meisten ökologisch, wenn sie ganz abgeschafft wird und dafür die Sätze der Einkomm.-Steuer gesenkt werden."
1651097881490,Thu Apr 28 05:18:01 WIB 2022,780,1495,16,36,1,Im Vergleich zu D und CH dürfen Kinder in Ö erst viel später selbständig Radfahren. Die Altergrenze herabsetzen!
1651097517020,Thu Apr 28 05:11:57 WIB 2022,779,1495,1,0,-1,"Direkte und damit echte Demokratie wie in der Schweiz statt Demokratiesurrogate wie solche ""Bürger""räte."
1651097383733,Thu Apr 28 05:09:43 WIB 2022,778,1495,1,0,-1,"Die Gesellschaftsform, wo eine Gruppe entschieden hat, was andere Menschen brauchen, ist in Europa 1989 beendet worden."
1651096635261,Thu Apr 28 04:57:15 WIB 2022,777,1486,1,0,-1,Ich lese immer nur Radwege ausbauen und fördern - es soll auch Menschen geben die NICHT radfahren wollen - oder auch gar nicht können!
1651096272544,Thu Apr 28 04:51:12 WIB 2022,776,1486,1,0,-1,Waren effizienter verpacken - meist ist der Karton viel zu groß - es wird mehr Luft und Füllmaterial als Ware transportiert!
1651066914484,Wed Apr 27 20:41:54 WIB 2022,403,841,71,36,1,Überholtverbot für LKW auf zweispurigen Autobahnen
1651066904642,Wed Apr 27 20:41:44 WIB 2022,402,681,69,104,1,Wien 1.Bezirk: nur mehr mit emmissionsfreien KFZ befahrbar
1651066877452,Wed Apr 27 20:41:17 WIB 2022,401,817,96,68,1,Flugreisen nach individuellen Kontingenten besteuern (z.B. alle 3000 km pro Jahr höherer Prozentsatz).
1651066854276,Wed Apr 27 20:40:54 WIB 2022,400,841,75,33,1,Es sollte mal die Wahrheit über de E-Autos erzählt werden wie wird litioum gewonnen wo werden die Akkus entsorgt wo kommt der Strom her AKW?
1651066823589,Wed Apr 27 20:40:23 WIB 2022,399,681,39,51,1,Wien: LKW > 7t nur mehr bis zur Stadtgrenze.
1651066730417,Wed Apr 27 20:38:50 WIB 2022,398,792,62,46,1,E-Fuels sind Teil der Energiewende. So kann die bestehende Infrastruktur genutzt und bestehende Fahrzeuge umweltfreundlich genutzt werden.
1651066724227,Wed Apr 27 20:38:44 WIB 2022,397,681,56,48,1,Wien: max. Kurz-Parkdauer auf 3h erhöhen.
1651066720312,Wed Apr 27 20:38:40 WIB 2022,396,863,10,43,1,Lieferung per LKW ist wie Individualverkehr zu sehen.  Eine Art Seilbahnsystem wäre erstebenswert.
1651066699046,Wed Apr 27 20:38:19 WIB 2022,395,847,128,48,1,günstige(max. 50.- bis. 100.-€ ) regionale JahresÖffitickets im Wohnumfeld/ Wohnregion
1651066617877,Wed Apr 27 20:36:57 WIB 2022,394,241,2,8,-1,Autobahn-Tempolimit abschaffen
1651066513067,Wed Apr 27 20:35:13 WIB 2022,393,841,130,12,-1,Alle reden vomumstieg auf Öffis dann sollte aber auch die Infrastruktur geschaffen werden das ich rechtzeitig in die Arbeit komme
1651066419059,Wed Apr 27 20:33:39 WIB 2022,391,859,135,56,1,"Ländliche Raum wird auch in Zukunft den PKW brauchen, nicht nur aus städtischer Sicht handeln"
1651066377754,Wed Apr 27 20:32:57 WIB 2022,390,851,1,0,-1,"Die Teilnehmer von der Statistik Austria ausgewählt, ist halt leider nicht so. Der ""Fragebogen"" entscheidet, als nur Günstlinge & co"
1651066317854,Wed Apr 27 20:31:57 WIB 2022,389,847,109,40,1,max 10min. Intervalle bei öffis zum öffitarif (dort wo dünn besiedelt durch kl. rufbusse bzw. pkw)
1651066266255,Wed Apr 27 20:31:06 WIB 2022,388,619,103,135,1,"Keine Neuzulassung von Verbrenner Autos in Österreich ab 2028, keine Fahrerlaubnis ab 2040"
1651066205768,Wed Apr 27 20:30:05 WIB 2022,387,241,1,0,-1,Menschen verbieten!
1651066145014,Wed Apr 27 20:29:05 WIB 2022,386,833,1,0,-1,"Tempo 30 in Ballungszentren. Veringert den Lärm, reduziert Abgase, erhöht Sicherheit."
1651066123702,Wed Apr 27 20:28:43 WIB 2022,385,187,179,228,1,Senken des Tempolimits auf Freilandstraßen ohne begleitende Rad-/Geh Infrastruktur auf max. 70 km/h um insbesondere das Radfahren zu attrakt
1651066098710,Wed Apr 27 20:28:18 WIB 2022,384,806,284,22,1,Echte Schnellzugverbindungen zu leistbaren Preisen zwischen europäischen Hauptstädten (Reduktion des Flugverkehrs)
1651066091727,Wed Apr 27 20:28:11 WIB 2022,383,832,203,137,1,"Ampelschaltungen auf Öffi und Fahrradverkehr optimieren, statt Autoverkehr!"
1651066036438,Wed Apr 27 20:27:16 WIB 2022,382,777,216,70,1,Flugtickets müssen um ein vielfaches teurer werden.
1651066001618,Wed Apr 27 20:26:41 WIB 2022,381,832,128,82,1,"Flugverbot über der Stadt, vor allem in der Nacht."
1651065992019,Wed Apr 27 20:26:32 WIB 2022,380,777,104,43,1,"Beim Flugbuchen muss der CO2 Abdruck einfach und verständlich so im Vorgang angegben werden, dass die Buchung noch stornierbar ist."
1651065923606,Wed Apr 27 20:25:23 WIB 2022,379,806,269,123,1,Klimaticket statt Pendlerpauschale
1651065922061,Wed Apr 27 20:25:22 WIB 2022,378,187,220,54,1,Freifahrt mit öffentlichen Verkehrsmitteln für alle Kinder und Jugendlichen bis 18 Jahre in ganz Österreich.
1651065912359,Wed Apr 27 20:25:12 WIB 2022,377,806,227,100,1,Steuerabsetzbarkeit des Klimatickets/Öffitickets anstelle Pendlerpauschale!
1651065906391,Wed Apr 27 20:25:06 WIB 2022,376,701,145,28,1,"Arbeitsplätze zu den Menschen bringen, nicht umgekehrt. Geographische Zentralisierung umkehren."
1651065734488,Wed Apr 27 20:22:14 WIB 2022,374,241,1,0,-1,IG-L Regeln abschaffen
1651065720683,Wed Apr 27 20:22:00 WIB 2022,373,241,1,0,-1,160 km/h auf Autobahnen
1651065714542,Wed Apr 27 20:21:54 WIB 2022,372,241,1,0,-1,IG-L 100er auf 160 erhöhen
1651065707261,Wed Apr 27 20:21:47 WIB 2022,371,241,1,0,-1,IG-L 100er abschaffen
1651065695417,Wed Apr 27 20:21:35 WIB 2022,370,241,1,0,-1,Sofortige Abschaffung der IG-L Tempolimits
1651065685436,Wed Apr 27 20:21:25 WIB 2022,369,241,1,0,-1,Abschaffung IG-L 100er!
1651065634043,Wed Apr 27 20:20:34 WIB 2022,368,804,86,93,1,Dieselfahrverbot in der Stadt oder Diesel höher versteuern
1651065560477,Wed Apr 27 20:19:20 WIB 2022,367,805,339,242,1,"City-Maut in Wien einführen, damit die Speckgürtel-Bewohner*innen nicht weiter die Luft verpesten"
1651065523156,Wed Apr 27 20:18:43 WIB 2022,366,806,262,233,-1,Was wollen wir? Autofreie Städte!
1651065519737,Wed Apr 27 20:18:39 WIB 2022,365,778,483,163,-1,"Mehr Platz zum Gehen und Radfahren, in der Stadt und auch entlang von Freilandstraßen; mehr gute Fahrradabstellanlagen"
1651065427337,Wed Apr 27 20:17:07 WIB 2022,364,617,288,289,1,"Geschwindigkeitsbegrenzungen im Ortsgebiet 30, Landstraße 80, Autobahn 100 km/h."
1651065415194,Wed Apr 27 20:16:55 WIB 2022,363,650,1,0,-1,Keine 80er oder 100er IGL-Tempobeschränkung auf Autobahnen mehr. Die Autobahn wurde zum schnellen Vorankommen gebaut.
1651065391665,Wed Apr 27 20:16:31 WIB 2022,362,793,128,245,1,Parkpickerl in ganz Wien wieder abschaffen!
1651065377943,Wed Apr 27 20:16:17 WIB 2022,361,617,1,0,-1,Große PKW massiv besteuern
1651065360040,Wed Apr 27 20:16:00 WIB 2022,360,758,111,176,1,Besondere Tempolimits (z.B. 80/100) für PKW mit hohem Treibstoffverbrauch u für schwere PKW (höhere Risiken für Teilnehmer mit leichten PKW)
1651064588072,Wed Apr 27 20:03:08 WIB 2022,347,188,1,0,-1,"Genehmigung des Neubaus oder der Erweiterung von Betriensanlagen nur, wenn Anbindung an öffentlichen Verkehr gegeben ist"
1651065322660,Wed Apr 27 20:15:22 WIB 2022,359,619,1,0,-1,In Mehrfamilienhäusern mit Garagen oder Parkplätzen müssen Ladestationen für e Autos errichtet werden
1651064576092,Wed Apr 27 20:02:56 WIB 2022,346,595,516,236,1,Städteplanung nicht mehr nach den Bedürfnissen des Individualverkehr. Verkehrberuhigung und Straßenrückbau wo möglich.
1651064563030,Wed Apr 27 20:02:43 WIB 2022,345,139,24,149,1,Keine Zulassung mehr von PKWs. Aufbau einer staatlichen Car-Sharing-Flotte.
1651064461734,Wed Apr 27 20:01:01 WIB 2022,341,661,1,0,-1,"Individualverkehr darf niemals eingeschränkt werden! Lieber in alternative Autoantriebssysteme investieren, aber nicht in E-Autos!"
1651064291103,Wed Apr 27 19:58:11 WIB 2022,333,139,80,165,1,Ab 1.1.2024 wird der Luftraum über Österreich sonntags für den Flugverkehr gesperrt.
1651064919721,Wed Apr 27 20:08:39 WIB 2022,358,661,208,331,1,Rückbau unnötiger Radwege die durch Verschmälerung der Fahrbahn entstanden sind! Somit weniger Stau und weniger Emissionen!
1651064891224,Wed Apr 27 20:08:11 WIB 2022,357,439,112,75,1,"Die ""Gemeinwohlökonomie"" als sinnvolle und realistische Alternative bewerben und fördern!"
1651064862264,Wed Apr 27 20:07:42 WIB 2022,356,630,40,125,1,"Jede Person soll einen Flug machen dürfen und wenn einer mehr fliegen will, soll er den Flug eines anderen kaufen!"
1651064732568,Wed Apr 27 20:05:32 WIB 2022,355,661,1,0,-1,Nummerntafeln und Führerschein für Fahrradfahrer einführen! Fahrradfahrer halten sich nicht an die Straßenverkehrsordnung!
1651064658708,Wed Apr 27 20:04:18 WIB 2022,354,574,167,120,1,Alle Öffentlicher Verkehrsmittel für alle Personen über 65 Jahren kostenlos zur Verfügung stellen.
1651064656295,Wed Apr 27 20:04:16 WIB 2022,353,241,1,0,-1,"Auftragsgutachten, die nur veröffentlicht werden, wenn das Ergebnis passt, gehören verboten."
1651064632444,Wed Apr 27 20:03:52 WIB 2022,352,241,1,0,-1,Leonore Gewessler soll angeklagt werden.
1651064618408,Wed Apr 27 20:03:38 WIB 2022,351,241,123,315,1,Parken soll gratis werden.
1651064613569,Wed Apr 27 20:03:33 WIB 2022,350,705,1,0,-1,"Städteplanung auf Fuß- und Radverkehr fokussieren (keine Umwege, Fußwege zwischen Gebäuden, Straßen für mehr Radverkehr!)"
1651064605472,Wed Apr 27 20:03:25 WIB 2022,349,241,1,0,-1,100er IG-L Zonen sollen sofort abgeschafft werden.
1651064592850,Wed Apr 27 20:03:12 WIB 2022,348,241,1,0,-1,IG-L Beschränkungen sollen sofort abgeschafft werden.
1651064557596,Wed Apr 27 20:02:37 WIB 2022,344,241,9,157,1,"Für Fahrräder, Mopeds und Motorräder sollen 30er-Tempolimits nicht gelten, da sie wendiger sind."
1651064492496,Wed Apr 27 20:01:32 WIB 2022,343,241,89,265,1,30er Zonen sollen gesetzlich verboten werden.
1651064477435,Wed Apr 27 20:01:17 WIB 2022,342,241,74,261,1,Es soll das Tempolimit auf Autobahnen abgeschafft werden.
1651064451461,Wed Apr 27 20:00:51 WIB 2022,340,724,129,171,1,"Ganze Straßen für Fahrräder, FußgängerInnen, Scooter, etc. frei machen. Mind. eine pro 0,5 KM in Quer - und Längsverbindung"
1651064448448,Wed Apr 27 20:00:48 WIB 2022,339,642,1,0,-1,"E-Scooter , elektrische Kinderfahrzeuge gehören verboten. Bewegung erhält die Umwelt und den Körper gesund."
1651064436603,Wed Apr 27 20:00:36 WIB 2022,338,705,1,0,-1,"Auf Autobahnen generell 100km/h - höhere Reichweite pro Tank/Ladung, mehr Sicherheit durch geringere Geschwindigkeitsunterschiede (LKW,PKW)"
1651064414783,Wed Apr 27 20:00:14 WIB 2022,337,619,96,177,1,"Besitzer von Einfamilienhäusern sollen verpflichtet werden, (geförderte) PV Anlagen UND Ladestationen für e Autos zu installieren"
1651064317920,Wed Apr 27 19:58:37 WIB 2022,336,676,1,0,-1,"Einzelne Feldwege asphaltieren als Radwege, schnell umsetzbar, keine langwierigen Verhandlungen mit Grundeigentümern."
1651064315800,Wed Apr 27 19:58:35 WIB 2022,335,724,13,12,-1,"Tempo 100 auf Autobahnen und Tempo 30 in Städten. Ist sozial gerecht, weil es arm und reich gleicht trifft."
1651064314148,Wed Apr 27 19:58:34 WIB 2022,334,684,1,0,-1,Verpflichtende Raumordnungsplanung bevor Baubewilligung erteilt wird. Gibt es Anbindung an öffentlichen Verkehr usw.
1651064259923,Wed Apr 27 19:57:39 WIB 2022,332,139,224,234,1,Sofortiger Stopp aller Straßenbauvorhaben. Wir müssen und werden 2030 signifikant weniger Verkehr als heute haben.
1651064252378,Wed Apr 27 19:57:32 WIB 2022,331,705,223,42,-1,Elektromobilität: Einheitliche Stecker (CCS) und Ladeleistungen (AC >=11kW) fürs In-Verkehr bringen von Neuwagen in Europa
1651064237432,Wed Apr 27 19:57:17 WIB 2022,330,139,100,251,1,Autofreier Sonntag
1651064189171,Wed Apr 27 19:56:29 WIB 2022,329,562,461,46,1,"Rascher Öffiausbau für PendlerInnen, kurze Intervalle."
1651064170522,Wed Apr 27 19:56:10 WIB 2022,328,703,309,104,1,"Ausbau kleiner Ruf-E-Busse in Ballungszentren und deren Umland, um Individualverkehr zu beggrenzen."
1651064158762,Wed Apr 27 19:55:58 WIB 2022,327,0,277,44,1,Die Taktung von Intercity Zugstrecken verdichten
1651064147687,Wed Apr 27 19:55:47 WIB 2022,326,705,180,73,1,"Elektromobilität: Es ist auch OK, 5 Minuten zum nächsten öffentlichen Ladepunkt zu gehen."
1651064076212,Wed Apr 27 19:54:36 WIB 2022,325,705,340,181,1,Sanfte Mobilität fördern durch mehr Miteinander auf den Straßen: Geringere Geschwindigkeiten und gesetzliche Mindestabstände + Kontrollen!
1651064069326,Wed Apr 27 19:54:29 WIB 2022,324,702,1,0,-1,The cost of rail tickets should be significantly reduced. If it was cheaper to travel by train more people would do it.
1651064045237,Wed Apr 27 19:54:05 WIB 2022,323,562,283,229,-1,"Primär: Öffis, Fuß- und Radwege auf dem Land rasch ausbauen, in der Stadt PKW-Verkehr ganz verbannen. Außer Zeiten für Zulieferer."
1651064039795,Wed Apr 27 19:53:59 WIB 2022,322,676,97,92,1,"Bestimmte Feldwege asphaltieren um ein überregionales Netz an Güterwegen/ Radwegen zu haben, so wie im Nordburgenland bereits vorhanden."
1651062763686,Wed Apr 27 19:32:43 WIB 2022,279,244,1,0,-1,"Mindesterreichbarkeit zu Mobilitätsknotenpunkten auf dem Land, siehe https://www.itf-oecd.org/innovations-better-rural-mobility"
1651063966555,Wed Apr 27 19:52:46 WIB 2022,321,539,142,120,1,"Idee: als Abdeckung des letzten Kilometers am Land: ein Art Taxi-System, nur mit selbstfahrenden Autos  z.b. für weg von Bahnhof nach Hause"
1651063966458,Wed Apr 27 19:52:46 WIB 2022,320,691,1,0,-1,Kerosin muss endlich eu-weit wie jeder andere Kraftstoff besteuert werden.
1651063959700,Wed Apr 27 19:52:39 WIB 2022,319,547,402,116,1,"Beschleunigung des öffentlichen, städtischen Oberflächenverkehrs (Bus&Bim) zB effizientere Ampelbeeinflussung"
1651063863548,Wed Apr 27 19:51:03 WIB 2022,318,684,1,0,-1,Wenn Ersatzbrennstoffe verwendet werden soll der Flug nicht verteuert werden
1651063845648,Wed Apr 27 19:50:45 WIB 2022,317,542,1,0,-1,Das Problem ist: viel zu viele Menschen an jedem Ort der Welt. Ich habe keine Kinder und verzichte daher auf nichts!
1651063778977,Wed Apr 27 19:49:38 WIB 2022,316,693,496,178,1,"Radwege gehören deutlich ausgebaut, gepflegt (Schneeräumung etc.) und von den Autos getrennt,  um den Umstieg aufs Rad attraktiv zu machen"
1651063757039,Wed Apr 27 19:49:17 WIB 2022,315,691,376,171,1,"Gratis Klimaticket-Tickets statt Pendlerpauschale. Endlich ein Incentive, den öffentlichen Verkehr am Land zu stärken."
1651063681426,Wed Apr 27 19:48:01 WIB 2022,314,161,178,44,1,Endlich sinnvolle Lösungen für die jahrelang tagtäglichen selben Staus = Reduzierung der Emissionen
1651063602288,Wed Apr 27 19:46:42 WIB 2022,313,0,465,123,-1,"Fahrradmitnahme bei Öffis gratis (Klimaticket). Mehr Mitnahmeplätze in Railjet, Nachtzug, etc."
1651063597922,Wed Apr 27 19:46:37 WIB 2022,312,0,248,222,1,Verbot von SUVs und schweren Lkws im Stadtgebiet. Im Bedarfsfall nur mit Warnposten und Schrittgeschwindigkeit erlaubt.
1651063578640,Wed Apr 27 19:46:18 WIB 2022,311,667,242,158,1,"Echtkosten beim Transport verrechnen! Letzten Kilometer, vor allem in Städten und Kommunen über Lastenradverkehr abwickeln."
1651063491332,Wed Apr 27 19:44:51 WIB 2022,310,244,166,69,1,Mobilitätsgarantie (Mindestbedienstandard ÖV) flächendeckend für alle Bürger:innen
1651063463255,Wed Apr 27 19:44:23 WIB 2022,309,443,64,81,1,"Kein Fernbusterminal für Wien, Wien ist ausreichend gut per Schiene erreichbar."
1651063442579,Wed Apr 27 19:44:02 WIB 2022,308,663,211,85,1,"Politiker sollten wenn sie unbedingt auf Partys, Veranstaltungen und co. anwesend sein wollen mit dem Zug fahren müssen!"
1651063435398,Wed Apr 27 19:43:55 WIB 2022,307,161,1,0,-1,Kennzeichen und Versicherungspflicht für Fahrräder und deren Fahrer
1651063421420,Wed Apr 27 19:43:41 WIB 2022,306,0,377,67,1,"Einheitliches Fahrplan-, Buchungs- und Ticketsystem (eine App) für öffentlichen Verkehr, spesenfrei, EU-weit + CH."
1651063416725,Wed Apr 27 19:43:36 WIB 2022,305,0,24,158,1,Ab sofort keine Neuwagen produzieren und verkaufen. Ausnahme für Blaulichtorgs. etc. Reparieren+Gebrauwagenmarkt reicht.
1651063410136,Wed Apr 27 19:43:30 WIB 2022,304,645,326,138,1,"Anstatt auf E-Mobilität zu setzen sollte jeder/r Einzelne von uns wieder mehr zu Fuß gehen, Radfahren oder auf unnötige Wege verzichten."
1651063407313,Wed Apr 27 19:43:27 WIB 2022,303,443,72,128,1,Kongresse ausschließlich online abhalten.
1651063380368,Wed Apr 27 19:43:00 WIB 2022,302,443,35,133,1,Verbot von Werbung auf Tourismus.
1651063374275,Wed Apr 27 19:42:54 WIB 2022,301,161,1,0,-1,Klare Vorschriften für das Verhalten im Straßenverkehr für alle Fahrradfahrer.
1651063350278,Wed Apr 27 19:42:30 WIB 2022,300,244,1,0,-1,Es braucht integrierte Stadt- und Mobilitätsplanung - weg vom Silodenken!  Auch umliegende Regionen und Pendelströme in Planung mitdenken!
1651063264515,Wed Apr 27 19:41:04 WIB 2022,299,613,1,0,-1,"Wer beweist uns wirklich, dass ""der Mensch"" das Klima ändert? Und wenn, sollten wir uns an nicht an ein anderes Klima anpassen?"
1651063255037,Wed Apr 27 19:40:55 WIB 2022,298,452,448,109,1,Bei Errichtung/Sanierung von Bundesstraßen und Schienen begleitende Fuß- und Radwege sowie Querungen für Rad- und Fußverkehr planen.
1651063218597,Wed Apr 27 19:40:18 WIB 2022,297,244,225,282,1,Hohe Steuern auf Zweit-Pkw innerhalb eines Haushalts
1651063169816,Wed Apr 27 19:39:29 WIB 2022,296,161,1,0,-1,E-Scooter im Straßenverkehr verbieten
1651063163282,Wed Apr 27 19:39:23 WIB 2022,295,0,231,139,-1,"""Anrecht"" auf Fahrradmitnahme in Öffis gesetzlich verankern (EU-weit)"
1651063156612,Wed Apr 27 19:39:16 WIB 2022,294,244,400,250,-1,"Massiv Parkplätze in Innenstädten reduzieren und für Fahrradstellplätze, lokale Läden und Gastronomie zur Verfügung stellen! (Siehe Paris)"
1651063146828,Wed Apr 27 19:39:06 WIB 2022,293,452,355,45,1,"Der Vermeidung von (längeren) Alltagswegen sollte mehr Aufmerksamkeit gewidmet werden (Prinzip ""Stadt der kurzen Wege"" forcieren)."
1651063116153,Wed Apr 27 19:38:36 WIB 2022,292,161,1,0,-1,Elterntaxis verursachen täglich Staus und blockieren/behindern alle Verkehrsteilnehmer
1651063100141,Wed Apr 27 19:38:20 WIB 2022,291,244,322,103,1,Bürger:innenbeteiligung bei Stadtteilplanung und Design von Mobilitätsangeboten.
1651055615670,Wed Apr 27 17:33:35 WIB 2022,121,0,56,124,-1,Eine Frage zu deiner Person: Ich wohne auf dem Land und habe keine gute Anbindung an den öffentlichen Verkehr.
1651063049678,Wed Apr 27 19:37:29 WIB 2022,290,452,454,50,1,Gute Fußwege-Anbindung sollte bei der Gestaltung von Haltestellen und Bahnhöfen  zwingend mitgeplant werden.
1651063049184,Wed Apr 27 19:37:29 WIB 2022,289,622,389,185,1,Stadtzentren ohne Autos! Park&Ride zu günstigen Preisen rund um das Zentrum. Am besten Tiefgaragen mit oberflächlicher Begrünung.
1651063049068,Wed Apr 27 19:37:29 WIB 2022,288,161,363,88,1,Infokampagne zur Förderung von Öffis bei Schülern um Elterntaxis zu minimieren.
1651063015242,Wed Apr 27 19:36:55 WIB 2022,287,452,374,56,-1,Die Errichtung von Fahrrad-Infrastruktur sollte nicht zu Lasten des Fußverkehrs geschehen.
1651063001366,Wed Apr 27 19:36:41 WIB 2022,286,621,1,0,-1,geht nur im Zusammenhang mit der Bereitstellung der entsprechenden Bahninfrastruktur und Transportvolumen
1651062989549,Wed Apr 27 19:36:29 WIB 2022,285,244,1,0,-1,Wir brauchen mehr nachhaltige Mobilitätspläne (SUMP) - nicht nur für urbane Regionen sondern auch anliegende Regionen einschließend!
1651062922546,Wed Apr 27 19:35:22 WIB 2022,284,161,375,56,1,"Home-Office, wo möglich, ausbauen und fördern um Arbeitswege zu sparen."
1651062879677,Wed Apr 27 19:34:39 WIB 2022,282,244,445,183,1,"Innovative Kleinstmobilität wie e-Tricycles, e-Lastenräder und weitere auf dem Land fördern! Dazu Radinfrastruktur ausbauen."
