timestamp,datetime,comment-id,author-id,agrees,disagrees,moderated,comment-body
1651310528786,Sat Apr 30 16:22:08 WIB 2022,1406,2224,68,26,1,Das Lastenfahrrad soll in die Planung der Radinfrastruktur stärker miteinbezogen werden
1651310523442,Sat Apr 30 16:22:03 WIB 2022,1405,2225,1,0,-1,"Radwege und Fußwege sollten sich nicht kreuzen und queren, sehr gefährlich für Fußgänger"
1651310475738,Sat Apr 30 16:21:15 WIB 2022,1404,2225,1,0,-1,Nummerntafeln und Haftpflichtversicherung für Radfahrer
1651310224261,Sat Apr 30 16:17:04 WIB 2022,1403,2214,51,20,1,"Klimaschutz und Mobilität funktioniert nur, wenn Grünflächen und Wälder erhalten werden. Bodenversiegelung beim Straßenbau streng bestrafen."
1651307994420,Sat Apr 30 15:39:54 WIB 2022,1402,2218,18,9,1,"Umrüsten von Verbrennungsmotoren auf X-Fuels, so fährt man C02 neutral. Wir schaffen uns so einen schaffbaren, weichen Übergang."
1651307435804,Sat Apr 30 15:30:35 WIB 2022,1401,2214,26,8,1,Langsame kurzgeführte Regionalzüge sind  unattraktiv und sollen zum Teil durch schnellere Direktverbindungen ersetzt werden.
1651307234435,Sat Apr 30 15:27:14 WIB 2022,1400,1473,51,27,1,UNBEDINGT entsprechende Co2-Bepreisung als wichtiges Instrument! ( im Gegenzug Lohnsteuer-Entlastung)
1651307205262,Sat Apr 30 15:26:45 WIB 2022,1399,2214,81,12,1,Mehr Schnellzüge machen die Öffis effektiver und attraktiver.
1651307039496,Sat Apr 30 15:23:59 WIB 2022,1398,2214,31,17,1,"Verbot großer LKWs, denn sie verursachen die stärkste Straßenzerstörung und CO2 Emmission. Elektro Kleintransporter, Schiene sind notwendig."
1651306568303,Sat Apr 30 15:16:08 WIB 2022,1397,2215,8,33,1,Mehr Geschwindigkeitsbegrenzungen für Verbrennungsmotoren. Elektromotoren und andere grüne Alternativen nicht einschränken.
1651305173443,Sat Apr 30 14:52:53 WIB 2022,1395,2206,23,35,1,Geschwindigkeit in Städten auf max. 40 km/h senken.  V..a auf Bundesstrassen z.b. ab Stadtgrenze Wien zur Feinstaub- & Lärmreduktion!
1651303948133,Sat Apr 30 14:32:28 WIB 2022,1394,2204,66,12,1,"Motor laufen lassen gehört streng bestraft. Aufklärung, wieviel man hier an Sprit, CO2 Ausstoß  und Geld sparen könnte."
1651303788888,Sat Apr 30 14:29:48 WIB 2022,1393,2204,93,22,1,"Kinder u. Erwachsene motivieren, Alltagsstrecken und Schulweg zu Fuß zu gehen, oder mit dem Rad zu fahren"
1651303596871,Sat Apr 30 14:26:36 WIB 2022,1392,2204,42,20,1,Carsharing sollte am Land von der Gemeinde zur Verfügung gestellt werden
1651302764405,Sat Apr 30 14:12:44 WIB 2022,1391,2201,1,0,-1,"Rasern (erlaubte Geschwindigkeit z.B. 30 km/h überschritten)  Auto weg, anstatt lächerlicher ""Buß""gelder!"
1651302700930,Sat Apr 30 14:11:40 WIB 2022,1390,2111,74,12,1,"Öffis attraktiver machen, v.a. für Arbeitsweg und Autobesitzer*innen. Günstiger, mehr Verbindungen und Platz, übersichtlichere Bahnhöfe..."
1651302391631,Sat Apr 30 14:06:31 WIB 2022,1389,2201,31,51,-1,"Pendlerpauschale komplett abschaffen, dafür Öffitickets zu 100% finanzieren. Wer dann weiterhin mit dem Auto pendelt = selber schuld!"
1651300969480,Sat Apr 30 13:42:49 WIB 2022,1388,2196,1,0,-1,Kerosinbesteuerung einführen - erhöht die Ticketpreise und reduziert den Flugverkehr.
1651300112595,Sat Apr 30 13:28:32 WIB 2022,1387,443,1,0,-1,"Autos müssen am Wohnort in einer Garage verschwinden, im Idealfall am Arbeitsort auch."
1651299510704,Sat Apr 30 13:18:30 WIB 2022,1386,443,9,25,-1,"Tempolimits an die Entwicklung im KFZ Bereich anpassen: zumindest 50, meist 70 im Ortsgebiet, 130 Freilandstraße, 180 Autobahn"
1651298730755,Sat Apr 30 13:05:30 WIB 2022,1385,443,87,3,1,"Beenden der Praxis, dass das Europaparlament einmal im Monat von Brüssel nach Straßburg übersiedelt. Spart such enorme Kosten, nicht nur CO2"
1651297704162,Sat Apr 30 12:48:24 WIB 2022,1384,2187,79,11,1,"Autos vor Bankomat, Apotheke, Trafik, Bar!!! laufen lassen-gehört strengstens bestrafen. Ist verboten, aber kümmert viele überhaupt nicht."
1651297594514,Sat Apr 30 12:46:34 WIB 2022,1383,0,31,15,-1,Für's Klima muss man an großen Rädern drehen und nicht den kleinen Mann sekkieren.
1651297571399,Sat Apr 30 12:46:11 WIB 2022,1382,2187,75,9,1,Flugtickets sollen mit tatsächlichem Aufwand verkauft werden - keine staatliche Stützung! Dann   ist der Flugverkehr automatisch reduziert!
1651297379964,Sat Apr 30 12:42:59 WIB 2022,1381,2187,64,32,1,"Autorennen, Flugshows, Feuerwerke und Böller schießen gehören sofort eingestellt - braucht niemand!"
1651297240293,Sat Apr 30 12:40:40 WIB 2022,1380,0,86,8,1,"länderübergreifenden Bahnverkehr einfacher machen, inklusive Fahrradversand & -mitnahme"
1651249010938,Fri Apr 29 23:16:50 WIB 2022,1311,2096,1,0,-1,Fahrradwege baulich besser von Längs-Parkplätzen trennen (Geländer?) Plötzlich aufgehende Autotüren sind extrem gefährlich für Radler:innen!
1651250761827,Fri Apr 29 23:46:01 WIB 2022,1318,2080,7,30,1,Auch Private sollten sich an der Finanzierung von Geschwindigkeitsüberwachungsanlagen beteiligen und von den Einnahmen profitieren können.
1651291122957,Sat Apr 30 10:58:42 WIB 2022,1379,2180,1,0,-1,Mehrzweckstreifen sind keine sicheren Radwege und dürfen auch nicht so bezeichnet werden!
1651275277336,Sat Apr 30 06:34:37 WIB 2022,1378,2177,33,15,1,Co2 emissionen sind nicht das hauptproblem im klimawandel - wir müssen uns besser gedanken im wiederaufforstung und wasser machen
1651275196582,Sat Apr 30 06:33:16 WIB 2022,1377,2177,20,9,1,Elektro Autos sind nicht die Lösung. Es gibt Eine zwischenlösung - HVO oil (reduziert 90% CO2 emissionen)
1651272758538,Sat Apr 30 05:52:38 WIB 2022,1376,2172,24,27,1,"km-abhängige maut auf allen straßen. einfache erfassung der km beim jährlichen pickerl, keine high-tech-lösung notwendig"
1651272609049,Sat Apr 30 05:50:09 WIB 2022,1375,2172,49,27,1,"finger weg von lückenschlüssen im grenzüberschreitenden hochrangigen straßennetz. keine neuen transitschneisen!! (emissionen, lärm, staus)"
1651272455853,Sat Apr 30 05:47:35 WIB 2022,1374,2174,10,6,-1,"Bei unserer Mini-Bevölkerungsdichte, auch im int. Vergleich, sollen Radler und Fußgänger zu wenig Platz haben?? 😂😂😂"
1651271117918,Sat Apr 30 05:25:17 WIB 2022,1373,2174,1,0,-1,"Es gibt Pandemie+Krieg und wir denken darüber nach, wie Ö „Klima-Vorbild“ (für wen?) wird u wie man unser Leben noch mehr einschränken kann!"
1651266783368,Sat Apr 30 04:13:03 WIB 2022,1372,2167,15,28,1,Autowerbung muss mit einem warnhinweis versehen werden - ähnlich wir bei tabakwerbung. Angeblich schon der Fall in frankreich
1651240028132,Fri Apr 29 20:47:08 WIB 2022,1290,2071,26,32,-1,Autofreie Städte/Orte/Siedlungen; Fußgänger*innenzonen & sichere Radwege. Ausbau öffentlicher Verkehrsmittel. Verbot fossiler Treibstoffe.
1651266163629,Sat Apr 30 04:02:43 WIB 2022,1371,2165,51,37,1,Priorität von Autofahren hinten anstellen. Innenstadt generell Tempo 30! Bestehende Straßen zu Einbahnen und Rest für Fußgänger/Radler/Öffi!
1651233880869,Fri Apr 29 19:04:40 WIB 2022,1234,2029,14,34,-1,"D. Klimawandel ist durch die ""Big 5"" auf dieser Welt ohnedies nicht aufzuhalten. Schauen wir doch, dass wir unseren Alltag genießen können!"
1651263778261,Sat Apr 30 03:22:58 WIB 2022,1366,2151,31,33,-1,"Die Politik muss reinen Wein einschenken: es geht leider nicht mehr, mit dem Auto herumzufahren wie man will"
1651236865567,Fri Apr 29 19:54:25 WIB 2022,1267,2038,41,43,1,"Studien & Bordcomputer zeigen: Mehrverbrauch=mehr Emissionen bei 30 statt 50km/h. Drum Schluss mit ausufernden, flächendeckenden 30er-Zonen!"
1651264760431,Sat Apr 30 03:39:20 WIB 2022,1370,0,13,21,1,"Schulbus für jede Klasse, jeder der mit dem Auto in die Arbeit fährt, muss beweisen dass es keine andere Möglichkeit gibt"
1651264270244,Sat Apr 30 03:31:10 WIB 2022,1369,2151,120,13,1,Alle Lkw auf die Schiene wie in der Schweiz (Ausnahme Nahverkehr Zustellung)
1651264189612,Sat Apr 30 03:29:49 WIB 2022,1368,2158,1,0,-1,"Gibt es beim Klimarat eh keinen Gruppenzwang, manipulative Methoden und einseitige Info? Frage nur!"
1651264016063,Sat Apr 30 03:26:56 WIB 2022,1367,2158,1,0,-1,"Frage an den Klimarat: Geht es da auch korrekt zu? Nicht, dass 100 Leute „bearbeitet“ werden und dann heißt es „Ganz Österreich will das so“"
1651263569450,Sat Apr 30 03:19:29 WIB 2022,1365,2151,48,20,1,Energiespar Werbetipps massiv ausbauen
1651263256156,Sat Apr 30 03:14:16 WIB 2022,1364,2151,17,10,-1,Kreisverkehr in städtischem Gebiet ausweiten statt Ampel. Wie in Frankreich
1651263147570,Sat Apr 30 03:12:27 WIB 2022,1363,2151,41,18,1,"Schulbus statt 1000e Eltern Autos: jede Klasse einen Schulbus, der alle bei der Schule abholt und wieder nach Hause bringt"
1651262107120,Sat Apr 30 02:55:07 WIB 2022,1362,2140,38,4,1,"Freue mich schon, Kanzler und Minister in der U6 und am Lastenfahrrad zu sehen! Oder soll das nur für uns gelten?"
1651261971390,Sat Apr 30 02:52:51 WIB 2022,1361,2140,1,0,-1,"Unglaublich, zu welcher Selbstgeißelung manche angeblich bereit sind, ohne zu fragen, was andere Länder und soz. Schichten eigentlich tun!"
1651261707773,Sat Apr 30 02:48:27 WIB 2022,1360,2140,1,0,-1,"Wenn es so leicht wär mit Öffi und Rad: Warum machen es die sog. ""Meinungsbildner"" nicht?  Wasser predigen, Wein trinken!"
1651261621931,Sat Apr 30 02:47:01 WIB 2022,1359,2145,48,24,1,"Transporte auf der Straße verteuern/einschränken, dann regelt sich vieles von selbst."
1651261598049,Sat Apr 30 02:46:38 WIB 2022,1358,2140,1,0,-1,"In Pandemiezeiten alle in Öffis zu drängen ist Wahnsinn. Aber ""in den Öffis steckt sich ja keiner an"", nur überall sonst."
1651261448982,Sat Apr 30 02:44:08 WIB 2022,1357,2140,1,0,-1,"Online-Portale haben einen Haken: Sie werden kaum von älteren Menschen genutzt. Und wenns ums Klima geht, sind fast nur Grün-Ideologen dabei"
1651261288564,Sat Apr 30 02:41:28 WIB 2022,1356,2140,1,0,-1,"Ich habe als Fußgänger immer genug Platz. Und wenn ich eine Fahrbahn queren will, bleiben immer nur Autofahrer, nie die Radfahrer stehen."
1651261077424,Sat Apr 30 02:37:57 WIB 2022,1355,2140,1,0,-1,"Würde man sich auch trauen, Fahrverbote und dgl. auch in Moskau oder Nordkorea vorzuschlagen?"
1651260949384,Sat Apr 30 02:35:49 WIB 2022,1354,2140,1,0,-1,Wenn sich das Welt-Klima wirklich durch diese Extrem-Maßnahmen in den wenigen Wohlstandsländern ändern ließe... Ist leider nicht so!
1651260738860,Sat Apr 30 02:32:18 WIB 2022,1353,2140,1,0,-1,Im 7.Bezirk zu wohnen und menschenleere Radlwiesen zu wollen ist wie auf der Alm zu wohnen und dort Wolkenkratzer und Citylife zu fordern!
1651260315680,Sat Apr 30 02:25:15 WIB 2022,1352,2140,1,0,-1,"Fair f. weniger Verkehr:  Autoverbot f. alle, die vor der eigenen Tür Verkehrsberuhigung wollen!  Und selbst durch fremde Gassen fahren!"
1651259606066,Sat Apr 30 02:13:26 WIB 2022,1351,2127,11,10,1,"Da gibt's ""Verweilplätze"" & die arbeitenden Anwohner (die keine Zeit zum ""Bankerlsitzen"" haben) kriegen keinen Parkplatz! Z.B. Ottakringerst"
1651259408854,Sat Apr 30 02:10:08 WIB 2022,1350,2127,1,0,-1,"Was nützen die schönsten ""Begrünungen"", wenn sie keiner mehr sieht (weil man in der U-Bahn sitzt oder zu Fuß u. mit Rad nicht weit kommt)?"
1651259238820,Sat Apr 30 02:07:18 WIB 2022,1349,2127,1,0,-1,Für's Klima muss man an großen Rädern drehen und nicht den kleinen Mann sekkieren. Aber beim kleinen Mann ist es halt leichter. Eh klar!
1651259109727,Sat Apr 30 02:05:09 WIB 2022,1348,2127,1,0,-1,"Radfahrer wollen alle Rechte haben. Dann brauchen sie auch Pflichten (Führerschein, Kennzeichen)."
1651259002903,Sat Apr 30 02:03:22 WIB 2022,1347,2127,1,0,-1,"Parkpickerl:  Was, wenn Sie ein paar Tage Gäste haben? Was, wenn Sie mal nicht im eigenen Auto unterwegs sind (Werkstatt- oder Mutti-Auto)?"
1651258675407,Sat Apr 30 01:57:55 WIB 2022,1346,2127,23,37,-1,"Lieber keine Klima-Vorbildrolle für Ö, sondern zufriedene, wohlhabende Menschen, die nicht mit Alltagsregeln zugepflastert werden!"
1651258512780,Sat Apr 30 01:55:12 WIB 2022,1345,2133,31,26,-1,"Wie viel Mobilität für ein gutes Leben? Das Zuviel hat zur Klimakrise geführt, weniger ist die Zukunft. Das Gute liegt so nah..."
1651258436598,Sat Apr 30 01:53:56 WIB 2022,1344,2127,1,0,-1,"Die Öko-Maßnahmen gelten nur dort, wo man sich traut: Also nicht für Politiker, Diplomaten,.. Respekt auch für andere Berufe und das Volk!"
1651258164819,Sat Apr 30 01:49:24 WIB 2022,1343,2127,1,0,-1,"Wenn die Schikanen gegen Autofahrer (Parkpickerl, Verkehrsstrafen...) so zumutbar sind:  WARUM GELTEN SIE DANN NICHT FÜR DIPLOMATEN??"
1651257664482,Sat Apr 30 01:41:04 WIB 2022,1342,2127,1,0,-1,Unvergessen Maria Vassilakou: Mit dem Radl vors Publikum & ums Eck packt der Chauffeur das Radl in den Kofferraum.
1651257567145,Sat Apr 30 01:39:27 WIB 2022,1341,2127,1,0,-1,"Das Volk soll sich abgfretten und für's Klima sorgen. Und die Politiker fliegen im Privatjet zum ""Umweltgipfel""!"
1651257472227,Sat Apr 30 01:37:52 WIB 2022,1340,2127,25,11,1,Die Dienstautos der (auch grünen) Politiker sagen genug! (Werner Koglers DIENSTWAGEN & CHAUFFEUR (!) war erst kürzlich in den Medien...)
1651257449188,Sat Apr 30 01:37:29 WIB 2022,1339,0,12,25,-1,Flugverbot - auch Luftschiffe
1651257357928,Sat Apr 30 01:35:57 WIB 2022,1338,0,77,28,1,Abschaffung des Dieselprivilegs.
1651257201333,Sat Apr 30 01:33:21 WIB 2022,1337,2127,44,21,1,"Frieden zwischen den Verkehrsteilnehmern, kein gegenseitiges Aufhetzen - und jeder soll nach SEINEN MÖGLICHKEITEN auf die Umwelt schauen!"
1651257089194,Sat Apr 30 01:31:29 WIB 2022,1336,2127,15,21,1,Der globale Klimawandel ist leider nicht zu verhindern (siehe Russland usw). Eine derartige Öko-Prohibitionszeit macht alles nur noch ärger.
1651256976886,Sat Apr 30 01:29:36 WIB 2022,1335,1284,1,0,-1,E-Autos: keine staatliche Vergünsitung für Luxusautos ab EUR 30.000
1651256658359,Sat Apr 30 01:24:18 WIB 2022,1334,2128,6,22,1,Kompromiss für kleine Geschwindigkeitssenkungen (Stadt 30/40 - Landstr. 90 - Autobahn 120)
1651256486746,Sat Apr 30 01:21:26 WIB 2022,1333,2128,28,10,1,"Steuern benutzen um regionale/österr. Waren zu verbilligen (zB. 0-10% MWSt.), EU-Produktion (10-20%) & weitere Transporte als Luxusgut (30%)"
1651256437767,Sat Apr 30 01:20:37 WIB 2022,1332,2127,1,0,-1,"Zur neuen StVO: Es kann nicht sein, dass nur Radler & Co BEGÜNSTIGT werden, aber nur Autofahrer & Co EINE PRÜFUNG zur StVO ablegen müssen."
1651256082109,Sat Apr 30 01:14:42 WIB 2022,1331,2127,1,0,-1,"- Die StVO wird immer nur für Motoristen, NIE für Radfahrer verschärft! - EINE KENNTNIS DER STVO wird aber NUR von Motoristen verlangt!"
1651255780628,Sat Apr 30 01:09:40 WIB 2022,1330,2127,28,30,1,"Mehr Rad-Infrastruktur NUR mit mehr Radler-Verkehrskompetenz (Nummerntafel, Gesetzesprüfung). Sonst landen wir in der Straßen-Anarchie!"
1651255495624,Sat Apr 30 01:04:55 WIB 2022,1329,2127,1,0,-1,Sicherheit im Radverkehr fördern: 1. Kennzeichenpflicht (wie bei allen anderen Fahrzeugen wie Mofas...)  2. Rad-Führerschein ab 12
1651254862223,Sat Apr 30 00:54:22 WIB 2022,1328,2115,43,24,-1,"Pendlerpauschale abschaffen! keine soziale Treffsicherheit, Steuervorteil größer für höhere Einkommen. kein großes Pendlerpauschale ab 2 km!"
1651254770728,Sat Apr 30 00:52:50 WIB 2022,1327,2115,1,0,-1,"Kerosin besteuern, Fliegen hat keine Kostenwahrheit, länderübergreifenden Bahnverkehr einfacher machen, inklusive Fahrradversand & -mitnahme"
1651254680881,Sat Apr 30 00:51:20 WIB 2022,1326,2115,83,29,1,SchulGehBus (gemeinsamer Schulweg zu Fuß) und autofreie Zonen vor den Schulen. Erziehung zur aktiven Mobilität in den Schulen!
1651254510384,Sat Apr 30 00:48:30 WIB 2022,1325,2115,70,9,1,"Versiegelung stoppen. Raumplanung weg von den Kommunen, max 2,5 Hektar versiegeln statt 11,5 ha täglich und Renaturierung von Brachen"
1651253795550,Sat Apr 30 00:36:35 WIB 2022,1324,2101,30,13,1,Einschränkungen in Öffis machen diese unattraktiv und sollen wieder abgeschaft werden. Das Klima ist wichtiger als Wählerstimmen.
1651252848928,Sat Apr 30 00:20:48 WIB 2022,1323,2101,32,16,1,"Taxis sollten günstiger und konkurrenzfähiger werden, denn sie können einen wertvollen Beitrag leisten."
1651252448235,Sat Apr 30 00:14:08 WIB 2022,1322,2117,1,0,-1,Für Radfahrer eine verpflichtende Ausbildung im Straßenverkehrrecht und eine  verpflichtende Haftpflichtversicherung.
1651252285628,Sat Apr 30 00:11:25 WIB 2022,1321,2101,93,13,1,"Ländliches Gebiet wird vernachlässigt. Rücksicht auf Augebiete, wassernahe Bereiche und Grünflächen bei der Verkehrsplanung ist wichtig."
1651251817525,Sat Apr 30 00:03:37 WIB 2022,1320,2101,15,34,1,"Fußgänger, Rad, kleine Fun-Elektrics, Skater gemeinsam am Gehweg und auf der Straße zulassen, keine Exklusivwege mehr für LKW und PKW."
1651251320047,Fri Apr 29 23:55:20 WIB 2022,1319,2107,50,16,1,Alle Autos durch E-Autos ersetzen ist kontraproduktiv. Dann haben wir die Staus mit E-Autos. Es ist ganz einfach kein Platz für mehr Autos.
1651250579956,Fri Apr 29 23:42:59 WIB 2022,1317,2101,23,15,1,Großflächige Bodenversiegelung und Naturgefährdung soll bei Ortsumfahrungen vermieden werden durch kleinräumige Unterflourtrassen!
1651250355566,Fri Apr 29 23:39:15 WIB 2022,1316,2113,73,13,1,In abgelegenen Talschaften sollte eine Fahrradmitnahme in Bussen möglich sein.
1651250211914,Fri Apr 29 23:36:51 WIB 2022,1315,2109,29,11,1,Emissionen wie Feinstaub von Bremsen und Gummiabrieb bei Maßnahmen zur optimalen Geschwindigkeitsfestlegung berücksichtigen
1651249914631,Fri Apr 29 23:31:54 WIB 2022,1314,2109,30,34,1,"Grundsätzlich sollte so wie in Mödling, Perchtoldsdorf 40 km/h österreichweit im Ortsgebiet gesetzlich verankert werden."
1651249574830,Fri Apr 29 23:26:14 WIB 2022,1313,2096,55,28,1,Auf dem Land Fahrrad attraktiver machen! Es werden zuviele Kurzstrecken im Ort mit dem PKW gefahren! Belohnungssystem f. gefahrene Rad-Km
1651249332415,Fri Apr 29 23:22:12 WIB 2022,1312,2096,60,30,1,"Mehr reservierte Fahrradplätze in Pendlerzügen einplanen! Hab trotz Klapprad oft Probleme, Plätze werden oft von „normalen“ Pendlern belegt!"
1651248331600,Fri Apr 29 23:05:31 WIB 2022,1310,2096,125,9,1,"Güterverkehr möglichst auf Schiene legen. Lärmschutz für Anrainer bedenken. Diesen begrünen, wo möglich für Energiegewinnung (PV!) nutzen."
1651247204691,Fri Apr 29 22:46:44 WIB 2022,1309,2100,119,10,1,Öffentliche Verkehrsmittel am Land fördern
1651246397694,Fri Apr 29 22:33:17 WIB 2022,1308,2095,69,11,1,"Nicht nur auf e-Autos setzen, auch der Strom hat Grenzen, besser an neuen Möglichkeiten forschen, mehr Geld für Forschung"
1651246266859,Fri Apr 29 22:31:06 WIB 2022,1307,2095,14,13,1,"Parkpickerl in Wien soll für ganz Wien, ausser 1.Bez., gelten. Jetzige Regelung ist nur Abzocke."
1651245925667,Fri Apr 29 22:25:25 WIB 2022,1306,2095,57,18,1,"Radwege sind gut, es braucht strengere Regeln für Radfahrer, die Fußgänger oder Autofahrer gefährden und auch Einsatzfahrzeuge ignorieren."
1651245723828,Fri Apr 29 22:22:03 WIB 2022,1305,2095,36,20,1,Verpflichtende Versicherung für Radfahrer und e-Scooter. Sie sollen mit einer Nummerntafel zu identifizieren sein.
1651245615040,Fri Apr 29 22:20:15 WIB 2022,1304,2095,9,18,1,"Der 1.Bezirk in Wien soll autofrei werden, aber sonst soll es ein Miteinander von allen Verkehrsteilnehmern geben, auch für Autofahrer!"
1651245181572,Fri Apr 29 22:13:01 WIB 2022,1303,2093,43,29,1,"Darauf abzielen, dass vorrangig Räder / E-Bikes, E-Autos im Carsharing und sonst Transportmittel wie Öffis, Taxis etc. verwendet werden."
1651244982226,Fri Apr 29 22:09:42 WIB 2022,1302,2090,67,33,1,Statt PKW Fahrer unterstützen müssen die Öffis ausgebaut werden . Private Autofahrten drastisch reduzieren.
1651244406003,Fri Apr 29 22:00:06 WIB 2022,1301,2043,126,17,1,Nebenbahnen ausbauen und attraktivieren und nicht Bahnstrecken einstellen bzw. auflassen
1651243507052,Fri Apr 29 21:45:07 WIB 2022,1300,2080,30,4,1,Alle Standards und Normen sollten kostenlos der Allgemeinheit (auch online) zugänglich gemacht werden. Dies würde z.B. Innovationen fördern.
1651241650901,Fri Apr 29 21:14:10 WIB 2022,1299,2029,33,32,1,"Wo gibt es ""zu schmale"" Gehsteige? Bin oft zu Fuß unterwegs, hatte noch nie das Gefühl, auf dem Gehsteig ""keinen Platz"" zu haben."
1651241379987,Fri Apr 29 21:09:39 WIB 2022,1298,2029,37,30,1,"Kilometergeld angemessen erhöhen! Dieses gilt ja nicht für den Weg zur Arbeit, sondern für geschäftliche Autofahrten (oft nötig)."
1651241376316,Fri Apr 29 21:09:36 WIB 2022,1297,131,1,0,-1,Laut Fr. Gewessler sind Entfernungen bis 5 km mit dem Rad zurückzulegen. Empfehlung dazu:  Ältere oder Gehbehinderte sollen daheim bleiben!
1651241136395,Fri Apr 29 21:05:36 WIB 2022,1296,2057,27,31,1,"Salzen nur auf Hauptverkehrsstraßen und Straßen für ÖV, keine Nebenstraßen. Räumen und Streuen-Geschwindigkeit wird automatisch reduziert."
1651241124066,Fri Apr 29 21:05:24 WIB 2022,1295,2029,1,0,-1,Vor 100 Jahren wären wir jetzt auch nicht am PC gesessen (der - man staune - mit Energie läuft).
1651240893696,Fri Apr 29 21:01:33 WIB 2022,1294,2029,1,0,-1,"ZUM KLIMARAT: Es scheint, als würden d.Teilnehmer erst ordentlich gebrainwashed, danach dürfen sie abstimmen. REALISTISCH BLEIBEN!"
1651240474251,Fri Apr 29 20:54:34 WIB 2022,1293,2038,29,40,1,"Nein zu höheren Emissionen durch gesteigerten Parkplatzsuchverkehr wegen immer mehr dogmatischer, rein mutwilliger Stellplatzvernichtung."
1651240352867,Fri Apr 29 20:52:32 WIB 2022,1292,2029,1,0,-1,"Grünflächen sind hübsch. Aber Parkplätze sind ein praktisches, gutgemeintes HILFSANGEBOT FÜR MENSCHEN, um ihnen den Alltag zu erleichtern."
1651240170214,Fri Apr 29 20:49:30 WIB 2022,1291,2029,38,43,1,Lieber ein wenig lebhafter Straßenlärm als im Regen mit 3 Einkaufstaschen und 3x umsteigen in unangenehmen Wagons (oder am Rad) zu sitzen!
1651239975697,Fri Apr 29 20:46:15 WIB 2022,1289,2029,1,0,-1,"Das techn. Meisterwerk ""Auto"" hat uns allen schon sehr viel gebracht! Bitte Schluss mit dieser scheinheiligen Verteufelung!"
1651239834795,Fri Apr 29 20:43:54 WIB 2022,1288,2029,1,0,-1,"Bitte endlich aufhören, die versch. Verkehrsteilnehmer gegeneinander aufzuhusten! Gegenseitige Toleranz!"
1651239769977,Fri Apr 29 20:42:49 WIB 2022,1287,858,29,19,-1,"Als Reaktion auf ""aber ich brauch das Auto"" Aussagen: Ja, es es wird nicht ohne Auto gehen aber Straßenverkehr muss reduziert werden."
1651239547573,Fri Apr 29 20:39:07 WIB 2022,1286,2029,24,12,1,Nicht jeder Schulweg ist für Rad oder Öffi geeignet!
1651239448997,Fri Apr 29 20:37:28 WIB 2022,1285,2029,18,13,-1,Benzinpreis ist kein Argument! Fördert die 2-Klassen-Gesellschaft!
1651239340637,Fri Apr 29 20:35:40 WIB 2022,1284,2029,41,20,1,"Jeder wohnt anders, arbeitet anders, hat einen anderen Alltag. Daher muss sich jeder sein Verkehrsmittel selbst aussuchen können!"
1651239225374,Fri Apr 29 20:33:45 WIB 2022,1283,2029,37,39,1,"In vielen Berufen braucht man einen PKW in der Stadt (etwa weil man mit PC, Produkten unterwegs ist) und adrett gekleidet sein soll."
1651239059481,Fri Apr 29 20:30:59 WIB 2022,1282,858,20,18,1,"Öffis günstig aber nicht gratis, denn gratis zieht Leute an, die kein Verkehrsmittel sondern einen warmen Raum suchen."
1651239033493,Fri Apr 29 20:30:33 WIB 2022,1281,2029,1,0,-1,"Autofreie Straßen sind oft verlassen, wirken gefährlich. Insb. wenn man vorher (wie oft) in der U-Bahn auf düstere Gestalten trifft..."
1651238863094,Fri Apr 29 20:27:43 WIB 2022,1280,2029,18,21,1,"""Autofrei"" heißt auch oft schlechte Erreichbarkeit (vor allem mit Gepäck), keine schönen Autos mehr auf der Straße, kein Lichtermeer abends."
1651238857666,Fri Apr 29 20:27:37 WIB 2022,1279,1929,72,21,1,Mitfahrzentralen fördern!
1651238641420,Fri Apr 29 20:24:01 WIB 2022,1278,2029,1,0,-1,"Ö soll Klima-Vorbildrolle übernehmen? Schön, aber i.d. Praxis verarmt das Volk, leidet im Alltag. Und der weltweite Klimawandel geht weiter."
1651238636988,Fri Apr 29 20:23:56 WIB 2022,1277,2046,1,0,-1,"Ende der Befragung, gilt nur für mich"
1651238297901,Fri Apr 29 20:18:17 WIB 2022,1276,2029,1,0,-1,"Gesunder Klimaschutz in Schulen ja, aber nicht Öko-Brainwashing (fördert künft. Konfliktpotenzial m. anderen Ländern)."
1651238125056,Fri Apr 29 20:15:25 WIB 2022,1275,2029,1,0,-1,"""Platz für alle"" heißt eben ""für ALLE"". Also auch für Autofahrer und ihre Fahrzeuge (von denen sicher jeder von uns schon profitiert hat)."
1651237949722,Fri Apr 29 20:12:29 WIB 2022,1274,2029,1,0,-1,Ob diese ganzen neuen Flug-Gegner auch wirklich nie mehr ferne Länder bereisen wollen??
1651237851401,Fri Apr 29 20:10:51 WIB 2022,1273,2029,1,0,-1,"Wenn neue Radsteifen, dann auch die Pflicht, diese zu benutzen! Und endlich eine Kennzeichenpflicht!"
1651237619290,Fri Apr 29 20:06:59 WIB 2022,1272,2029,1,0,-1,"Zukunft: Politiker & Reiche gemütlich im PKW, alle anderen im U-Bahn-Schacht oder Regentag am Lastenfahrrad. Wollen wir das?"
1651237435939,Fri Apr 29 20:03:55 WIB 2022,1271,2029,1,0,-1,Warum soll die Ampel-Wartezeit für Fußgänger verkürzt werden und für motorisierte Mitbürger nicht?? Gleichbehandlung ist anders.
1651237274575,Fri Apr 29 20:01:14 WIB 2022,1270,2029,1,0,-1,"Antidiskriminierung gefragt! Es ist muss egal sein, aus welchem Land man kommt, welche Hautfarbe man hat - und ob man PKW oder anderes nutzt"
1651237088201,Fri Apr 29 19:58:08 WIB 2022,1269,2052,58,22,1,"Politik muss attraktives Angebot an Sharing Angeboten+Öffis bereitstellen, sodass Privathaushalte besser auf eigne Autos verzichten können"
1651237069342,Fri Apr 29 19:57:49 WIB 2022,1268,2029,1,0,-1,"Der Autofahrer soll also immer ""zahlen""! Der Klimawandel passiert auch so und am Ende hat die Elite die Straße allein für sich!"
1651236864157,Fri Apr 29 19:54:24 WIB 2022,1266,2050,1,0,-1,Zudem macht es das Radfahren sicherer!
1651236827090,Fri Apr 29 19:53:47 WIB 2022,1265,2050,1,0,-1,Realistische Steuern!!
1651236813205,Fri Apr 29 19:53:33 WIB 2022,1264,2029,1,0,-1,"Die aggressive Wortwahl vieler ""ja so guten Ökos"" gegenüber Andersdenkenden sagt viel über deren wahren Wertekodex!"
