timestamp,datetime,comment-id,author-id,agrees,disagrees,moderated,comment-body
1651682293119,Wed May 04 23:38:13 WIB 2022,2117,2989,1,0,-1,"Start den gesamten LKW mit der elektrischen Eisenbahn zu transportieren, wäre ein europaweit genormtes Containersystem besser"
1651699230294,Thu May 05 04:20:30 WIB 2022,2137,2762,1,0,-1,"Kein sinnloses Im Kreis fahren von motorisierten Fahrzeugen, total unnötig"
1651699163952,Thu May 05 04:19:23 WIB 2022,2136,2762,1,0,-1,Keine Autorennen und Motorradrennen mehr !!!!!!!!
1651698999978,Thu May 05 04:16:39 WIB 2022,2135,2998,1,0,-1,Elektromobilität: Unsere Bequemlichkeit DARF nicht zu Lasten eines sozial- und umweltschädlichen Rohstoffabbaus in anderen Ländern gehen
1651698846528,Thu May 05 04:14:06 WIB 2022,2134,2998,1,0,-1,Elektromobilität: unsere Bequemlichkeit DARF nicht zu Lasten von sozial- und umweltschädlichem Rohstoffabbau in anderen Ländern gehen !
1651698335030,Thu May 05 04:05:35 WIB 2022,2133,3012,1,0,-1,"Skandinavische stadtplaner heranziehen, haben erfahrung mit radverkehr!"
1651697655174,Thu May 05 03:54:15 WIB 2022,2132,3010,1,0,-1,Tempo 80/ 110 für frieden in der ukraine
1651696399396,Thu May 05 03:33:19 WIB 2022,2131,3007,1,0,-1,"Langenlois, Hollabrunn,... sollten einen Citybus bekommen, der mindestens stündlich im Rundkurs Bahnhof, Geschäfte und Wohngebiete verbindet"
1651695840830,Thu May 05 03:24:00 WIB 2022,2130,3006,1,0,-1,Wenn jede Fluggast-Landung in Europa eine Klimagebühr (z.B 100 Euro) zusätzlich kostet wären Kurzstrecken per Flug gleich viel unattraktiver
1651695643681,Thu May 05 03:20:43 WIB 2022,2129,3007,1,0,-1,"Ostbahnbrücke 4-spurig ausbauen, neue Schnellbahn über die Strecke Praterkai-Süßenbrunn, kein Lobautunnel"
1651695266622,Thu May 05 03:14:26 WIB 2022,2128,3007,1,0,-1,"Jede Gasse Wiens sollte 3 Kurzparkplätze zum ein-/ ausladen auch für Private haben. Normale Parkplätze reduzieren, dafür mehr Grün"
1651694727371,Thu May 05 03:05:27 WIB 2022,2127,3006,1,0,-1,Mehr Begegnungszonen mit Schrittempo für Autos in Städten machen Radfahren und zu Fuß gehen sicherer und steigern Lebensqualität
1651694581775,Thu May 05 03:03:01 WIB 2022,2126,3006,1,0,-1,100 km/h Maximalgeschwindigkeit für Individualverkehr senkt Spritverbrauch und Unfallzahlen und macht Öffentlichen Verkehr attraktiver.
1651688681924,Thu May 05 01:24:41 WIB 2022,2125,2997,1,0,-1,"Fussgänger und Radfahrer, dann erst die Autofahrer!"
1651686366044,Thu May 05 00:46:06 WIB 2022,2124,2996,1,0,-1,Es müssen ineffiziente Zweitakter-Moped verboten werden. Besser für Jugend e-Antrieb herschenken als Gewöhnung an Verbrenner lernen lassen.
1651684581123,Thu May 05 00:16:21 WIB 2022,2123,2989,9,5,1,Kontaktlose Übertragung von Elektrischer Energie bei Bushaltestellen und angrenzender Beschleunigungszone. E-Buse im Fahrbetrieb laden
1651684477468,Thu May 05 00:14:37 WIB 2022,2122,2993,1,0,-1,Ein bisschen die Lebensmitteltransporte besser abzustimmen und deren Transportnotwendigkeit zu bewerten.
1651684314505,Thu May 05 00:11:54 WIB 2022,2121,2993,1,0,-1,"LKW die ein Drittland beliefern egal wo, unbedingt auf die Schiene, wie kommt ein Land dazu fremden Dreck abzubekommen."
1651683633563,Thu May 05 00:00:33 WIB 2022,2120,2991,1,0,-1,Ein möglichst breites Portfolio an Klimafreundlichen Mobilitätsmaßnahmen unterstüzten. z.B.: Biosprit (wenn Umweltfreundlich)
1651683298967,Wed May 04 23:54:58 WIB 2022,2119,2991,1,0,-1,"Der Klimawandel kennt keine Grenzen, Umso wichtiger ist es Öffis auch über Bundesländergrenzen hinweg zu fördern (Wiener U-Bahn auch in NÖ)"
1651683098492,Wed May 04 23:51:38 WIB 2022,2118,2991,1,0,-1,Wichtig ist die Kostenwahrheit bei der Mobilität. So sollte im Energiepreis auch etwaige Folgeeffekte entsprechend eingepreist werden
1651680248734,Wed May 04 23:04:08 WIB 2022,2116,1128,1,0,-1,Der Vollausbau der batteriegebundenen E-Mobilität scheitert an Rohstoffen und Netzkapazitäten. Fördergeld sinnvoller in Kraftwerke stecken!
1651680085748,Wed May 04 23:01:25 WIB 2022,2115,1128,1,0,-1,"Wir wären schneller und effektiver, wenn wir Stationärverbraucher vorrangig mit Strom versorgen würden. Mobilität ist ungleich schwieriger!"
1651680051263,Wed May 04 23:00:51 WIB 2022,2114,2988,1,0,-1,Radwege (und auch Gehsteige) müssen breiter und sicherer sein.
1651680003126,Wed May 04 23:00:03 WIB 2022,2113,1128,1,0,-1,"Produktion v. Synfuels (Wasserstoff, Methan, Methanol) in wind- und sonnenreichen Gebieten anstelle von Akkus. Stationäranlagen ans E-Netz!"
1651679976294,Wed May 04 22:59:36 WIB 2022,2112,2988,1,0,-1,Öffi-Ticket muss immer billiger sein als Flug oder Autofahrt (auch mehrköpfige Familie)
1651679926007,Wed May 04 22:58:46 WIB 2022,2111,2988,1,0,-1,Verbot von Dumping-Preisen auf Flug-Tickets
1651679884608,Wed May 04 22:58:04 WIB 2022,2110,2988,1,0,-1,In weniger dicht besiedelten Gebieten Sammeltaxis via App statt starre Fahrepläne (wie ISTmobil) -> österreichweit einheitlich
1651679729764,Wed May 04 22:55:29 WIB 2022,2109,2988,1,0,-1,Werbung für Autos mit Verbrennungsmotoren verbieten
1651679705153,Wed May 04 22:55:05 WIB 2022,2108,2988,1,0,-1,Umstellung auf Taxis mit Elektro-Antrieb
1651679665940,Wed May 04 22:54:25 WIB 2022,2107,2988,1,0,-1,"E-Tankstellen bei größeren Betriebsniederlassungen, damit Mitarbeiter(-innen), die auf Individualverkehr angewiesen sind, laden können"
1651679633319,Wed May 04 22:53:53 WIB 2022,2106,2988,1,0,-1,"Förderung bzw. Verpflichtung, dass Unternehmen ihre Dienstwagenflotte auf E-Antrieb umstellen."
1651678576496,Wed May 04 22:36:16 WIB 2022,2105,2882,1,0,-1,"Start-/Landekosten am Flughafen deutlich anheben, um für die Schäden aufzukommen"
1651678499402,Wed May 04 22:34:59 WIB 2022,2104,2882,1,0,-1,Keine Subventionierung mehr von Flughafen und Flügen
1651678435927,Wed May 04 22:33:55 WIB 2022,2103,2882,1,0,-1,Parkpickerl-Preis in Wien soll von der Größe des Autos (= Nutzung des öffentlichen Raums) abhängig gemacht werden: je größer - desto teurer
1651678334607,Wed May 04 22:32:14 WIB 2022,2102,2982,1,0,-1,Befürworter von Lastenrädern sollten ein Jahr lang ausschließlich diese als fahrbaren Untersatz benutzen dürfen.
1651678324511,Wed May 04 22:32:04 WIB 2022,2101,2882,10,4,1,Wien Fahrschein für Kernzone soll auch für die angrenzenden Orte Gültigkeit haben
1651678271738,Wed May 04 22:31:11 WIB 2022,2100,2882,1,0,-1,"Wien: dringender und intensver Ausbau der öffentlichen Verkehrsmittel v.a. in den Flächenbezirken, wie z.B. Donaustadt und Floridsdorf"
1651678190967,Wed May 04 22:29:50 WIB 2022,2099,2882,1,0,-1,"Keine neuen Hochleistungsstraßen / Autobahnen errichten, im Bau befindliche Projekte hinterfragen und versuchen zu stoppen bzw. umzuplanen"
1651676344386,Wed May 04 21:59:04 WIB 2022,2098,2984,10,10,1,ASFINAG in 'Radfinag' umwandeln und überregionales Radwegenetz seitens des Bundes planen und umsetzen
1651676255401,Wed May 04 21:57:35 WIB 2022,2097,2984,1,0,-1,"Ortsdurchfahrt am Land: Fahrbahnen verschmälern zugunsten Rad- und Gehweg, dadurch niedrigere Geschwindigkeit, weniger Lärm, weniger CO2"
1651676087457,Wed May 04 21:54:47 WIB 2022,2096,2984,1,0,-1,"Pendlerpauschale streichen, dafür Klimaticket für alle Arbeitnehmer gratis. Ländliche Regionen im Gegenzug über andere Förderungen stärken."
1651675493980,Wed May 04 21:44:53 WIB 2022,2095,2983,1,0,-1,"Umstieg nur auf E-Autos erfordert viel Strom, der produziert werden muss."
1651675404840,Wed May 04 21:43:24 WIB 2022,2094,2983,1,0,-1,"CO2 freie Treibstoffe sollen forciert werden, sie sind für Benzin-u.Dieselmotoren geeignet."
1651675257604,Wed May 04 21:40:57 WIB 2022,2093,2983,1,0,-1,"Es sollten bei Supermärkten, Einkaufszentren, ... Schilder aufgestellt werden, die an das Abstellen des Automotors erinnern!"
1651667340053,Wed May 04 19:29:00 WIB 2022,2092,2966,7,11,1,Vereinfachung von Mobilitätsmix: Lastenradkompatible Öffis.
1651663921312,Wed May 04 18:32:01 WIB 2022,2091,2973,1,0,-1,Ausbau von Fahrradboxen für hochwertige Fahrräder
1651663520286,Wed May 04 18:25:20 WIB 2022,2090,2962,1,0,-1,"Alle KFZ (v.a. auch E-Bikes, E-Scooter, ...) vom Radweg verbannen."
1651662124669,Wed May 04 18:02:04 WIB 2022,2089,2962,1,0,-1,"CO2-Steuer auf die tatsächlichen Emissionen einführen, d.h. auch für den echten Strommix, e-fuels und für Fahrzeuge well-to-wheel"
1651661846871,Wed May 04 17:57:26 WIB 2022,2088,2964,1,0,-1,"Hybride Mobilitätsangebote sollten verbessert werden, etwa durch sichere Radabstellplätze (oder auch Parkplätze) bei ÖffiStationen etc."
1651661780063,Wed May 04 17:56:20 WIB 2022,2087,2966,1,0,-1,Lobautunnel und Stadtautobahn canceln
1651659666676,Wed May 04 17:21:06 WIB 2022,2086,2956,23,5,1,"Rollende Super- und Drogeriemärkte + Arztbusse, die Dörfer ohne Nahversorger anfahren."
1651658888087,Wed May 04 17:08:08 WIB 2022,2085,2962,1,0,-1,Gemischte Verkehrsflächen (v.a. Radfahrer & Fußgängerwege) vermeiden.
1651658882591,Wed May 04 17:08:02 WIB 2022,2084,2963,1,0,-1,"Doppelte KFZ Steuer auf Verbrenner SUVs größer 2 Tonnen, keine Förderung für emissionsfreie PKW größer 2.5 Tonnen."
1651658734091,Wed May 04 17:05:34 WIB 2022,2083,2962,1,0,-1,"Kennzeichenpflicht für Fahrräder, da damit eine größere Akzeptanz der Radfahrer erreicht und der Fahrraddiebstahl reduziert wird."
1651658616572,Wed May 04 17:03:36 WIB 2022,2082,2963,1,0,-1,"Abgas und Lärmkontrolle für jede Form von Fahrzeug, sofortige Stilllegung bei Überschreitung."
1651658457139,Wed May 04 17:00:57 WIB 2022,2081,2963,1,0,-1,"Nach Norden schauen, dort hat man bereits Lösungen gefunden, man muss das Rad nicht nochmals erfinden"
1651658439448,Wed May 04 17:00:39 WIB 2022,2080,2962,1,0,-1,"KFZ-Besteuerung auch von Fahrzeuggewicht, -größe und Reifenbreite abhängig machen (Fahrbahnabnutzung, Flächenverbrauch, Abrieb steigen!)"
1651057838994,Wed Apr 27 18:10:38 WIB 2022,181,189,502,378,-1,"Ich möchte mir nicht vorschreiben lassen, welches Verkehrsmittel ich zu benützen habe."
1651574501403,Tue May 03 17:41:41 WIB 2022,1983,2660,1,0,-1,"Treibstoff ist zu billig, es laufen täglich noch immer unzählige Autos im Stand warm"
1651572161188,Tue May 03 17:02:41 WIB 2022,1982,2844,1,0,-1,"Walter HOFER zum Thema Verkehr: - LKW-Geschwindigkeiten digital auf Einhaltung überwachen - nur noch ""intelligente"" Ampeln errichten"
1651558344547,Tue May 03 13:12:24 WIB 2022,1948,1797,1,0,-1,In den Städten Radhighways nur für Radfahrer errichten. Dafür: Radfahrverbot auf großen Autostraßen
1651558256825,Tue May 03 13:10:56 WIB 2022,1947,1797,1,0,-1,Spritpreise mindestens verdreifachen; Mit dem Geld: Gratisfahrt auf alle Verkehrsmittel in Österreichs für alle!
1651556135612,Tue May 03 12:35:35 WIB 2022,1946,2792,1,0,-1,Verpflichtung für Supermärkte saisonal & regional verfügbare Lebensmittel bevorzugt anzubieten anstatt aus dem Ausland zu importieren
1651556065353,Tue May 03 12:34:25 WIB 2022,1945,2792,1,0,-1,Mehrwertsteuersenkung auf regionale bio Lebensmittel bzw Mehrwertsteuererhöhung auf importierte und tierische Lebensmittel
1651555662554,Tue May 03 12:27:42 WIB 2022,1944,2790,1,0,-1,"Mobilität als ein Service denken: mit dem  Klimaticket soll man überall von A nach B kommen, notfalls auch mit inkludiertem bike-Sharing"
1651555258643,Tue May 03 12:20:58 WIB 2022,1943,2789,1,0,-1,Verpflichtendes Veganes Menü in der Gemeinschaftsverpflegung als Wahloption.
1651555046811,Tue May 03 12:17:26 WIB 2022,1942,2789,1,0,-1,Bio-Richtlinien sollen der neue Standard in der Tierhaltung sein.
1651549524439,Tue May 03 10:45:24 WIB 2022,1941,443,1,0,-1,Inzervallverdichtung der Öffis. U-Bahn Wien maximal 3 Minuten zwischen 05:30 und 22:00.
1651549433060,Tue May 03 10:43:53 WIB 2022,1940,443,1,0,-1,Einschränkung des MIV bedeutet großen Zeitverlust und Reduktion der Lebensqualität. Ausgleich durch Reduktion Arbeitszeit & -belastung
1651545871260,Tue May 03 09:44:31 WIB 2022,1939,2783,1,0,-1,"Regelmässige Öffi Verbindungen auch ausserhalb der typischen Bürozeiten (vor allem in den Morgen- und Abendstunden), z.B. für Pflegeberufe!"
1651542173383,Tue May 03 08:42:53 WIB 2022,1938,2472,1,0,-1,Mikro-ÖV Strategie (door to door) für ganz Europa (die ganze Welt) mit alternativen Antrieben.
1651532396579,Tue May 03 05:59:56 WIB 2022,1937,2777,1,0,-1,"Bei 30 km/h und Begegnungs Zonen soll der Asphalt entfernt werden. Spart CO2, Kosten und Bodenversiegelung."
1651531967571,Tue May 03 05:52:47 WIB 2022,1936,2770,1,0,-1,"Förderung des Radverkehrs macht auch Autofahren angenehmer, weil weniger Autos. In den Niederlanden ist Autofahren weltweit am angenehmsten"
1651531777864,Tue May 03 05:49:37 WIB 2022,1935,2777,1,0,-1,"Wertschätzung in Öffis fördern durch Sicherheits-/Sozial- Personal. Mobbing u. Streit vermeiden, psychisch kranke beruhigen. Bisher: Polizei"
1651531696582,Tue May 03 05:48:16 WIB 2022,1934,2770,1,0,-1,In Städten wohnen viele Leute auf wenig Platz. Autos transportieren wenige Leute auf viel Platz. Daher sollten Städte autofrei werden.
1651531600056,Tue May 03 05:46:40 WIB 2022,1933,2770,1,0,-1,Fokus auf Radfahren verbessert auch den Autoverkehr. Denn weniger Autos erzeugen weniger Stau/ Frust.
1651531489743,Tue May 03 05:44:49 WIB 2022,1932,2770,1,0,-1,"Je mehr Auto-Infrastruktur gebaut wird, umso weniger funktioniert sie. Vergleich USA - Niederlande."
1651530876580,Tue May 03 05:34:36 WIB 2022,1931,2777,1,0,-1,Raucher machen 1/3 der Bevölkerung aus und werden aus dem Öffentlichen Verkehr quasi hinausgeekelt. Klima ist wichtiger als Rauchverbot.
1651530424658,Tue May 03 05:27:04 WIB 2022,1930,2777,1,0,-1,"Wieder viele Abteilwägen in Öffis, auch Kurzstrecke.  Bequem, helfen gegen Infektionen, schaffen Privatgefühl. Komfort wie im Auto schaffen!"
1651530179085,Tue May 03 05:22:59 WIB 2022,1929,2777,1,0,-1,"Freiheitsbeschränkungen, fehlendes Gepäckmanagement, unbequeme Sitze etc. machen Öffis unattraktiv und sollen wieder abeschafft werden."
1651530017697,Tue May 03 05:20:17 WIB 2022,1928,2777,1,0,-1,Zuviele Verbote in Öffis! Bsp. Das generelle Rauchverbot in Langstrecken Öffis hat deren Nutzung reduziert und sie unattraktiver gemacht.
1651528691228,Tue May 03 04:58:11 WIB 2022,1927,2770,1,0,-1,"Kostenwahrheit fürs Autofahren. Warum soll ich, der ich kein Auto habe, mit meinen Steuern dafür zahlen, dass andere mir Asthma verursachen."
1651528439840,Tue May 03 04:53:59 WIB 2022,1926,2770,1,0,-1,Gute Öffis überall. ZB Sammeltaxis in abgelegenen Orten.
1651527964598,Tue May 03 04:46:04 WIB 2022,1925,2773,1,0,-1,80/100 km/h  Landstr./Autobahnen für fossile Verbrennungsmotoren und 100/130 km/h für klimafreundliche Motoren einführen.
1651527959118,Tue May 03 04:45:59 WIB 2022,1924,2770,1,0,-1,"Die Politik sollte einsehen, dass Autoverkehr in Städten einfach nicht funktioniert und aufhören, alles aufs Auto auszulegen."
1651527530331,Tue May 03 04:38:50 WIB 2022,1923,2773,1,0,-1,"Keine Strafen für Fußgänger, Radfahrer, Skater, Sagways etc. auf Straßen. Gemeinsame Nutzung wo möglich."
1651527061383,Tue May 03 04:31:01 WIB 2022,1921,2763,1,0,-1,"Landwirte, die mit landw. Schulen, interessierten Arbeitslosen oder Auszubildenden brachliegende Flächen bewirtschaften= Lohn mtl. 2000 EUR"
1651526961330,Tue May 03 04:29:21 WIB 2022,1920,2763,1,0,-1,"Sofortiges Verbot von Pyrotechnik für Private. Hohe Strafen (ab 500 EUR für Kauf, Besitz, Verwendung), ab 1000 EUR f. Import aus CZ etc."
1651526889473,Tue May 03 04:28:09 WIB 2022,1919,2763,1,0,-1,"Motorräder, alle 4-spurigen Fahrzeuge müssen abgeregelt werden aufgrund der österr. STVO (max. 130, für LKW, Trucks u.a. max. 80 bzw.100 kmh"
1651526734056,Tue May 03 04:25:34 WIB 2022,1918,2763,1,0,-1,"Tempobolzer (auch ausländische Kennzeichen!) sofort aus dem Verkehr ziehen (Überwachung über GPS, digitale Vignette, Bordcomputer etc.)"
1651526682082,Tue May 03 04:24:42 WIB 2022,1917,2770,16,10,1,Superblocks nach dem Vorbild in Barcelona. Durchfahrt mit dem KFZ durch Wohngebiete verbieten (Böller auf Straße aufstellen).
1651526640100,Tue May 03 04:24:00 WIB 2022,1916,2763,1,0,-1,"Bundes- und Landesstrassen - max. 80 km/h, unattraktiv für Raser, Tuner etc. machen (Verschmälerung, Alleen), strenge Kontrollen (Drohnen?)"
1651526330126,Tue May 03 04:18:50 WIB 2022,1915,2763,1,0,-1,"Bewirtschaftung der Wälder mittels Pferden statt Harvester, Förderung Demeterlandwirtschaft und Permakultur, Bienenstöcke bei jedem Feld"
1651526322750,Tue May 03 04:18:42 WIB 2022,1914,2770,1,0,-1,"Viele Leute wollen mit dem Rad fahren. Sorgt dafür, dass sie dabei keine Todesangst haben."
1651526252267,Tue May 03 04:17:32 WIB 2022,1913,2773,29,5,1,"Für Ältere, Kranke, psychisch Kranke, Menschen mit Einschränkung muss es wohlwollende Maßnahmen im Öffentlichen Verkehr geben!"
1651526225361,Tue May 03 04:17:05 WIB 2022,1912,2763,1,0,-1,"Forcierung des Ausbaus der Landwirtschaft mit Hilfe landwirtschaftlicher Schulen,  kleinstrukturierte Landwirtschaft (Förderung AMS, Bund)"
1651526128824,Tue May 03 04:15:28 WIB 2022,1911,2763,1,0,-1,"Wiederbelebung von Nebenbahnen, Wiederaufnahme von ehemaligen Mühlen, Renaturierung von Gewässern, Mühlbächen und Aktivierung für Mühlen"
1651526057412,Tue May 03 04:14:17 WIB 2022,1910,2770,1,0,-1,"Subventionen fürs Autofahren nur für Menschen, die wirklich davon abhängig sind."
1651526028781,Tue May 03 04:13:48 WIB 2022,1909,2763,1,0,-1,"Verdichtung des öffentlichen Verkehrs, mehr Kleinbusse, Rufbusse , Shuttlebusse mit E- oder H- Antrieb anstatt leerer großer Busse"
1651525997588,Tue May 03 04:13:17 WIB 2022,1908,2770,1,0,-1,Sämtliche Subventionen für Flugverkehr abschaffen
1651525952874,Tue May 03 04:12:32 WIB 2022,1907,2763,1,0,-1,"Keine Baugenehmigungen auf der grünen Wiese - Förderungen nur mehr für Sanierung, Renovierung, Ausbau bestehender Objekte, Klimafreundlich"
1651525886626,Tue May 03 04:11:26 WIB 2022,1906,2763,1,0,-1,Förderungen für Betriebsansiedelungen und Wohnbauförderungen auf landwirt.Flächen werden eingestellt und müssen zurückgezahlt werden
1651525771173,Tue May 03 04:09:31 WIB 2022,1905,2773,1,0,-1,Viele Politiker und Bürgermeister füttern Wähler u. Medien mit Falschaussagen und Teilwahrheit über Initiativen. Strenge Strafen einführen.
1651525746580,Tue May 03 04:09:06 WIB 2022,1904,2763,1,0,-1,"Gefällte Bäume der letzen 20 Jahre müssen altersentsprechend ersetzt werden, Baum 10 Jahre - neuer Baum auch 10 Jahre oder 2x 5 Jahre"
1651525720251,Tue May 03 04:08:40 WIB 2022,1903,2770,1,0,-1,Autofahren muss zur Ausnahme werden (nur wenn man wirklich darauf angewiesen ist). Weniger Autos bedeutet weniger Stau und weniger Unfälle.
1651525684242,Tue May 03 04:08:04 WIB 2022,1902,2772,1,0,-1,Parkgebühr in Ballungsräumen auch für Anrainer
1651525660492,Tue May 03 04:07:40 WIB 2022,1901,2763,1,0,-1,"Bäume müssen ersetzt werden (öffentlich und privat), und zwar dem Alter entsprechend: zb Baum 10 Jahre - Neupflanzung 2x 5 od. 1x 10 Jahre"
1651525589149,Tue May 03 04:06:29 WIB 2022,1900,2763,1,0,-1,"Asfinag und Co müssen sämtliche Grünflächen sorgsam mähen, 2x im Jahr, keine Verletzung der Grasnaben"
1651525459710,Tue May 03 04:04:19 WIB 2022,1898,2763,1,0,-1,"Verbot von Rasenrobotern, Harvester, Laubsauger und Laubbläser, öffentliche Flächen dürfen nur mehr 2x im Jahr gemäht werden, vor/nach Blüte"
1651525382023,Tue May 03 04:03:02 WIB 2022,1897,2763,1,0,-1,"Sämtliche Windschutzgürtel der letzten 20 Jahre müssen wieder aufgebaut werden mit heimischen Gehölzen (Dirndl, Holunder, etc)"
1651525319521,Tue May 03 04:01:59 WIB 2022,1896,2763,1,0,-1,"Sämtliche freien landwirtschaftlichen Flächen sofort nutzen für Streuobstwiesen, Getreide, Gemüse, Bio Hühner, Schweine etc.,Permakultur"
1651525251512,Tue May 03 04:00:51 WIB 2022,1895,2770,1,0,-1,"Alle(!) Kosten, die durch Autoverkehr entstehen, mit KFZ-Steuer finanzieren. --> KFZ-Steuer anheben, Geringverdiener entlasten."
1651525217197,Tue May 03 04:00:17 WIB 2022,1894,2763,1,0,-1,"Österreich zum Katastrophengebiet erklären, damit die Bürgermeister keine Handhabe mehr haben, alles zu verbauen (und noch mitzuverdienen)"
1651525173072,Tue May 03 03:59:33 WIB 2022,1893,2763,1,0,-1,"Keine Baugenehmigungen mehr für Büro- und Feriensiedlungen - Zerstörung von Flora-- und Fauna für die, die es sich leisten können"
1651525069685,Tue May 03 03:57:49 WIB 2022,1892,2763,1,0,-1,Wohnungen werden gebaut (Immoentwickler verdienen) und vermietet (aber 3-4 x die Betriebskosten) - Vorsorgewohungen - muss abgestellt werden
1651524920783,Tue May 03 03:55:20 WIB 2022,1891,2763,1,0,-1,"Banken müssen ebenfalls in die Pflicht genommen werden, jeder EUR Zinsertrag  f. Versiegelung muss 50 % in den Klimafonds bezahlt werden"
1651524824869,Tue May 03 03:53:44 WIB 2022,1890,2763,1,0,-1,"Wien hat Baugesetz seit 1980 (kein Parkplatz unter 100m²),Leute nach NÖ getrieben, dort Versiegelung damit forciert - muss zahlen f. Klima!"
1651524725054,Tue May 03 03:52:05 WIB 2022,1889,2763,1,0,-1,Strafzahlungen an den Klimafonds von Gemeinden (auch Wien) - alle haben mit Vorsatz umgewidmet (zB Liesing) oder nicht rückgewidmet
1651524654708,Tue May 03 03:50:54 WIB 2022,1888,2763,1,0,-1,"Erhöhung der Grundsteuer für Wohnbauten auf landwirtschaftlichen Flächen etc. - niemand kann sagen, dass er das nicht gewußt hat"
1651524601468,Tue May 03 03:50:01 WIB 2022,1887,2763,1,0,-1,"Erhöhung der Grundsteuer f. Objekte auf landwirtschaftlichen Flächen o.ä: 20fach: Garagen,Autowaschplätze, Autoverkaufsflächen, Tankstellen"
1651524509095,Tue May 03 03:48:29 WIB 2022,1886,2763,1,0,-1,"Strafzahlungen an den Klimafonds durch die Nutznießer der Gewerbegebietsverbauungen (Bauern, Bürgermeister, Gemeinderäte, Immoentwickler etc"
1651524424132,Tue May 03 03:47:04 WIB 2022,1885,2763,1,0,-1,"Prüfung der Mittäterschaft von Versiegelungen durch landesnahe Banken, Raikas etc. die Interesse an Grundstücken, Schigebieten etc. haben"
1651524349250,Tue May 03 03:45:49 WIB 2022,1884,2763,1,0,-1,"Sofortiger Entzug der Baugenehmigungen von Gemeinden und Ländern, versiegelte Flächen MÜSSEN in 10 bisw 20 facher Höhe renaturiert werden"
1651524252699,Tue May 03 03:44:12 WIB 2022,1883,2763,1,0,-1,"Baugenehmigungen aufgrund Baugesetzen, die älter als 5 Jahre sind müssen sofort vor Baubeginn widerrufen werden - Vorsatz: Naturzerstörung!"
1651524156430,Tue May 03 03:42:36 WIB 2022,1882,2763,1,0,-1,"Keine neuen Supermärkte auf der grünen Wiese, keine neuen Bauten auf landwirtschafltichen Flächen, Wäldern, Wiesen, Genehmigungen widerrufen"
1651524065111,Tue May 03 03:41:05 WIB 2022,1881,2763,1,0,-1,"Gewerbliche Objekte, auch öffentliche,  mit Flachdächern MÜSSEN binnen 5 Jahren Photovoltaik installieren, auch alle Lärmschutzwände"
1651523971509,Tue May 03 03:39:31 WIB 2022,1880,2763,1,0,-1,"gewerbliche Abstellflächen, Supermarktparkplätze MÜSSEN binnen 5 Jahren Grasgittersteine verlegen, 25 % Grünflächen davon 50% Bäume"
1651523852564,Tue May 03 03:37:32 WIB 2022,1879,2763,1,0,-1,"Losted Places- Nutzung statt neue Aufschliessungen, keine neuen Bau-/Gewerbeberechtigungen, solange leerstehende Objekte vorhanden"
1651523788013,Tue May 03 03:36:28 WIB 2022,1878,2763,1,0,-1,"verbaute Flächen renaturieren für Lebensmittelanbau, Wildtiere, Grünflächen, je ha in den letzten 20Jahren - 10 ha Grünfläche (Gemeinden!)"
1651523615605,Tue May 03 03:33:35 WIB 2022,1877,2763,1,0,-1,"LKW Fahrgebot 1. Spur - Verlangsamung des Transits, Reduktion Erdölimport und Emissionen, Transit soll unattraktiv werden - Bahn nutzen!"
1651523499527,Tue May 03 03:31:39 WIB 2022,1876,2763,1,0,-1,"Überwachung aller Fahrzeuge über GPS auf Höchstgeschwindigkeit, Drängeln, Ausbremsen, sofortige hohe Strafen für ausländische Fahrzeuge"
1651523361229,Tue May 03 03:29:21 WIB 2022,1875,2763,1,0,-1,"Bundes- und Landstrassen - Höchstgeschwindigkeit 80 km/h, LKW Fahrverbot außer Lebensmittel - u. Kleintransporter mit E- u. H-Antrieb"
1651523276251,Tue May 03 03:27:56 WIB 2022,1874,2763,1,0,-1,"Abregelung von PKW bei 140 km/h, Transporter + Trucks 110 km/h, LKW 80 km/h= weniger Emissionenm, weniger Abrieb, weniger Unfälle"
1651523143863,Tue May 03 03:25:43 WIB 2022,1873,2763,1,0,-1,"LKW Geschwindigkeit auf Autobahnen 80 km/h, striktes Überholverbot von LKW, LKW Verbot auf Landstrassen außer für Lebensmitteltransporte"
1651522751123,Tue May 03 03:19:11 WIB 2022,1872,2762,1,0,-1,"Auto- und Motorradrennen, die nur im Kreis fahren verbieten"
1651509928916,Mon May 02 23:45:28 WIB 2022,1857,2117,1,0,-1,Auch Radfahrer müssen sich an Geschwindigkeitsvorschriften wie die 30km/h halten!
1651521152428,Tue May 03 02:52:32 WIB 2022,1871,2365,1,0,-1,IG-L Beschränkungen müssen auch für E-Autos gelten. Der Reifenabrieb ist derselbe oder durch das höhere Gewicht sogar größer.
1651521073543,Tue May 03 02:51:13 WIB 2022,1870,2365,1,0,-1,Kfz-Steuer auch für E-Autos. Diese brauchen den gleichen Platz wie normale Autos.
1651521060328,Tue May 03 02:51:00 WIB 2022,1869,2759,1,0,-1,"Öffis ausbauen, Öffis kostenlos, weitere Anreize schaffen zum Umsteigen auf Rad"
1651521029015,Tue May 03 02:50:29 WIB 2022,1868,2365,1,0,-1,Abschaffung der grünen Kennzeichen für E-Autos. E-Autos sind nicht grün.
1651520892208,Tue May 03 02:48:12 WIB 2022,1867,2759,1,0,-1,"Verkehrsaufkommen reduzieren, Gewohnheiten aufbrechen"
1651514458209,Tue May 03 01:00:58 WIB 2022,1866,2747,1,0,-1,Bauordnungen etc.: Ladeinfrastruktur (zumindest Leerverrohrung) für Parkplätze von Autos und Fahrrädern vorschreiben.
1651514409230,Tue May 03 01:00:09 WIB 2022,1865,2747,1,0,-1,"Bauordnungen etc.: überdachte, gut erreichbare, sichere Radabstellplätze reichlich vorschreiben!"
1651514344475,Tue May 03 00:59:04 WIB 2022,1864,2747,1,0,-1,Fahrräder-Beleuchtung: den Herstellern gut verstaute Ersatzlämpchen und werkzeuglose Lämpchentausch-Möglichkeit vorschreiben.
